lyrics,artist,song_title,featuring
"[Intro]
Shh... quiet... you hear that?
What the fuck, son?
I'm telling you, man, you gotta watch these niggas

[Chorus]
I'm paranoid, bitch, I can't sleep
Niggas trying to get me, man, give me my heat
Put one under my pillow, one under my seat
Niggas looking at me like I'm something to eat

[Verse 1]
We thought the coke and the dope would help us escape poverty
When that didn't work we resorted to armed robbery
Yeah, I done it, but I ain't the one they said did it
Before my first verse my Benz had been kitted
I'm so hood, that's what the bitches like about me
She bob and weave, she up and down, she suck the life up out me
I tell you 'bout my regimen, I blow a stack stunting
The coldest shit I'm on it, kid, I'll blow a nigga fronting
I'm dirty, yeah, I do that dirt, I'm down to put that work in
I kick the door to get them bricks, that Eagle get to chirping
You see that beam on ya head, nigga leaking
Yeah, screaming and shit, man, shut the fuck up

[Chorus]
I'm paranoid, bitch, I can't sleep
Niggas trying to get me, man, give me my heat
Put one under my pillow, one under my seat
Niggas looking at me like I'm something to eat
I'm paranoid, bitch, I can't sleep
Niggas trying to get me, man, give me my heat
Put one under my pillow, one under my seat
Niggas looking at me like I'm something to eat

[Verse 2]
I had a dream niggas got me
Woke up, a nigga shot me
I ain't slept in three days
My eyes red, something wrong with my head
The MAC stashed right under the pillow on my bed
It's not hot, why the fuck am I sweating?
My heart beating, I'm bugging, I wreck it
Bitch, don't move, it's dark, I might panic
Just sit still, I mean it, God damn it
My back against the wall
Fuck the world, I'll kill 'em all
Ain't a nigga too big or too small
Chop 'em down, watch 'em fall
Watch 'em bleed, watch 'em crawl
Watch 'em bleed 'til they gone

[Chorus]
I'm paranoid, bitch, I can't sleep
Niggas trying to get me, man, give me my heat
Put one under my pillow, one under my seat
Niggas looking at me like I'm something to eat
I'm paranoid, bitch, I can't sleep
Niggas trying to get me, man, give me my heat
Put one under my pillow, one under my seat
Niggas looking at me like I'm something to eat
I'm paranoid

[Bridge]
I can't even fucking sleep (I'm paranoid)
Bitch, quit playing, hand me my heat (I'm paranoid)
I can't even rest my head (I'm paranoid)
I'm fin to leave me a nigga dead

[Outro]
What? Niggas ain't fucking with me
I wish a nigga would
I've been taking it easy on these niggas, mane
I've been easy on 'em ,mane
I'ma turn it up now, yeah",50 Cent,I’m Paranoid,
"[Intro]
Ah-ha man! Ayy you know where them niggas be at right?
Take me to 'em

[Chorus]
All through the hood I keep hearin' niggas sayin' (Bap, bap, bap, bap, bap, bap)
I'm supposed to die tonight
Niggas done put a hit out and they talkin' like the shit okay (Bap, bap, bap, bap, bap, bap)
I'm gonna ride tonight
We rollin', whip stolen, AK loaded
I'm gonna ride tonight
We smokin' (Uh-huh), straight loc'n, lockin' loadin'
Somebody gon' die tonight

[Verse 1]
This is not new, I been in this position before
Grandma crib, niggas outside of her door
Different day, same shit, old MAC, new clip
32 hollow-tips, gloves, no rubber grip
I'm a boss, but niggas never show no respect
I catch 'em slippin', I'll have 'em tongue-kissin' my TEC
Go on, come, test me, pussy boy, don't try it
Police response never fast enough to shots fired
Don't be stupid, find out who you fuckin' with son
'Fore we find out where yo bitch get her hair and nails done
It's elementary, life is but a dream
You know row, row your boat, your blood forms a stream
After you get hit, you shoulda thought about the shit
You took that paper you take a life or yo life get took bitch
Sometimes I sit and look at life from a different angle
Don't know if I'm God's child or I'm Satan's angel

[Chorus]
All through the hood I keep hearin' niggas sayin' (Bap, bap, bap, bap, bap, bap)
I'm supposed to die tonight
Niggas done put a hit out and they talkin' like the shit okay (Bap, bap, bap, bap, bap, bap)
I'm gonna ride tonight
We rollin', whip stolen, AK loaded
I'm gonna ride tonight
We smokin', straight loc'n, lockin' loadin'
Somebody gon' die tonight

[Verse 2]
In 2002, if you asked me to make a wish
I simply woulda wished that my music would be a hit
Big said, ""Damn, niggas wanna stick me for my paper
And pray for my downfall,"" I understand it all
But me, I'm a little more flashy a nigga
So chances are, I'ma have to blast me a nigga
I'm on that Kevlar vest shit, that Wild Wild West shit
There's 81 one karat stones in my necklace
I shine so hard, I make motherfuckers wan' kill me
Every projects in every hood I go, they feel me
Know it sounds like rap, but this shit is real B
I don't talk that rich shit, but nigga I'm filthy
When I come out to play, and my mob ain't with me
You can bet your bottom dollar that revolver with me
Homeboy, frontin' on me'll shorten your lifespan
Hold the mic with my left, my knife in my right hand
Yeah!

[Chorus]
All through the hood I keep hearin' niggas sayin' (Bap, bap, bap, bap, bap, bap)
I'm supposed to die tonight
Niggas done put a hit out and they talkin' like the shit okay (Bap, bap, bap, bap, bap, bap)
I'm gonna ride tonight
We rollin', whip stolen, AK loaded
I'm gonna ride tonight
We smokin', straight loc'n, lockin' loadin'
Somebody gon' die tonight",50 Cent,I’m Supposed to Die Tonight,
"[Produced by Sonny Digital]

[Verse 1: 50 Cent]
I came in the world cryin' and fussin'
Nigga, we ain't have nothin'
Every ghetto I know the same
We trying to make a little change
Preacher man come around talkin'
I don't wanna hear it, keep walkin'
I'ma put the powder in the pot
Whip it 'till I'm pullin' off a lot
Imagine when I pull it off the lot
New shit come without a top
Once I'm on I ain't never gon' stop
Bitch, I'm on, I ain't never gon' stop

[Interlude: Sonny Digital]
I'm the man, I'm the man, I'm the man
I'm the man, I'm the man, I'm the man

[Verse 2: 50 Cent]
Aye, came in the game gettin' money
Flippin' chickens, whip it, gettin' money
Niggas get to playin' with the money
Clique bang for the money
Shit changed over money
They love to see a nigga on the bottom
Catch it coming, gotta keep it on the low
A nigga plug bless a nigga with a whole
Wanna break the bitch down into 36 O's
Looky here, bitch, I'm A-okay
Shorty wanna fuck with me
Stripping, yeah, the jiggy, nigga
Lady, she gon' hit my line
We ain't gon' waste no time
She sucking and we fucking like she need me
While she make a bankroll easy
All the light in the room from the T.V
We gettin' it on then I'm gone
It's the type of shit that a nigga be on

[Bridge: 50 Cent]
Too much on my mind right now
I'm on the grind right now
Looking for me, sucker, then I need to be found right now
I got my nine right now
Bitch, I'll blow your mind right now
I ain't fucking around right now
Better get in line right now
Or fuck around and die right now
Hope you understand that

[Hook: Sonny Digital]
Bitch, I'm the man, ho, I'm the man you know I'm the man
Bitch, I'm the man, ho, I'm the man you know I'm the man
Bitch, I'm the man, ho, I'm the man you know I'm the man
Bitch, I'm the man, ho, I'm the man you know I'm the man

[Verse 3: 50 Cent]
I'm a bonafide grade A hustler
A1, day 1, they can't touch us
Nigga like me, I be with the shit
Try and stick me I'ma get you hit
Yeah, you know just how I get down
Bad bitches around, they smoking and they drinking
And I'm thinking it can all work out
Seen your bitch back blown out
It's never nothing personal, believe me
I fuck around, your bitch don't wanna leave me
She talking 'bout takin' flights tonight when I'm out of town
Not around, she want me to fly in to put it down
It's nothing to a real nigga, had that ass flying in first class
'Cause you seem to be regular, she don't want nothing regular
Turn me on when she talk Spanish, that fat ass
You know I wanna get with it, so lady let's get it

[Bridge: 50 Cent]
Too much on my mind right now
I'm on the grind right now
Looking for me, sucker, then I need to be found right now
I got my nine right now
Bitch, I'll blow your mind right now
I ain't fucking around right now
Better get in line right now
Or fuck around and die right now
Hope you understand that

[Hook: Sonny Digital]
Bitch, I'm the man, ho, I'm the man you know I'm the man
Bitch, I'm the man, ho, I'm the man you know I'm the man
Bitch, I'm the man, ho, I'm the man you know I'm the man
Bitch, I'm the man, ho, I'm the man you know I'm the man",50 Cent,I’m the Man,Sonny Digital
"[Produced by Dr. Dre & Mike Elizondo]

[Intro]
Go, go, go, go, go, go
Go Shorty, it's your birthday
We gon' party like it's your birthday
And we gon' sip Bacardi like it's your birthday
And you know we don't give a fuck, it's not your birthday

[Chorus]
You can find me in the club, bottle full of bub'
Look, mami, I got the X if you into takin' drugs
I'm into havin' sex, I ain't into makin' love
So come give me a hug if you into gettin' rubbed
You can find me in the club, bottle full of bub'
Look, mami, I got the X if you into takin' drugs
I'm into havin' sex, I ain't into makin' love
So come give me a hug if you into gettin' rubbed

[Verse 1]
When I pull up out front, you see the Benz on dubs (Uh-huh)
When I roll twenty deep, it's twenty knives in the club (Yeah)
Niggas heard I fuck with Dre, now they wanna show me love
When you sell like Eminem and the hoes, they wanna fuck (Woo)
Look homie, ain't nothin' changed: hoes down, G's up
I see Xzibit in the cut, hey nigga, roll that weed up! (Roll it!)
If you watch how I move, you'll mistake me for a player or pimp
Been hit with a few shells, but I don't walk with a limp (I'm aight)
In the hood in L.A. they sayin', ""50, you hot"" (Uh-huh)
They like me, I want 'em to love me like they love Pac
But holla in New York, the niggas'll tell you I'm loco (Yeah)
And the plan is to put the rap game in a chokehold (Uh-huh)
I'm fully focused, man, my money on my mind
Got a mil' out the deal and I'm still on the grind (Woo)
Now Shorty said she feelin' my style, she feelin' my flow (Uh-huh)
Her girlfriend with her, they bi and they ready to go (Okay)

[Chorus]
You can find me in the club, bottle full of bub'
Look, mami, I got the X if you into takin' drugs
I'm into havin' sex, I ain't into makin' love
So come give me a hug if you into gettin' rubbed
You can find me in the club, bottle full of bub'
Look, mami, I got the X if you into takin' drugs
I'm into havin' sex, I ain't into makin' love
So come give me a hug if you into gettin' rubbed (Rubbed)

[Bridge]
My flow, my show brought me the dough
That bought me all my fancy things
My crib, my cars, my clothes, my jewels
Look, nigga, I done came up and I ain't changed (What? What? Yeah)

[Verse 2]
And you should love it way more than you hate it
Nigga, you mad? I thought that you'd be happy I made it (Woo)
I'm that cat by the bar toastin' to the good life
You that faggot-ass nigga tryin' to pull me back, right?
When my joint get to pumpin' in the club, it's on
I wink my eye at yo' bitch, if she smiles, she gone
If the roof on fire, let the motherfucker burn
If you talkin' about money, homie, I ain't concerned
I'ma tell you what Banks told me:
""Cuz, go 'head, switch the style up
If niggas hate, then let them hate, and watch the money pile up""
Or we can go upside your head with a bottle of bub'
They know where we fuckin' be

[Chorus]
You can find me in the club, bottle full of bub'
Look, mami, I got the X if you into takin' drugs
I'm into havin' sex, I ain't into makin' love
So come give me a hug if you into gettin' rubbed
You can find me in the club, bottle full of bub'
Look, mami, I got the X if you into takin' drugs
I'm into havin' sex, I ain't into makin' love
So come give me a hug if you into gettin' rubbed (Ha-ha-ha-ha)

[Outro]
Don't try to act like you don't know where we be neither, nigga
We in the club all the time, nigga, so pop, pop off, nigga
G-Unit",50 Cent,In Da Club,
"[Chorus: Brooklyn]
I still be ridin' through the hood
Brooklyn to Compton, it's all good
From Southside Queens to Inglewood
We representin' like we should

[Verse1: 50 Cent]
I'm hot, boy, I told you befo'
Got that Benz and that Hummer off the showroom floor
I know you hate it when I pop up, wrist all rocked up
'Hood empty, niggas locked up, they rats all knocked up
Baby after baby, the 'hood is crazy
Niggas'll set ya up and wet you up, trust me, they shady
Got a pet bulldog I keep under my linen
It don't bark, it spark when that revolver spinnin'
We winnin'

[Chorus: Brooklyn]
I still be ridin' through the hood
Brooklyn to Compton, it's all good
From Southside Queens to Inglewood
We representin' like we should

[Verse 2: 50 Cent]
Hold up, hold up, get a good look at my rims
Goddamn, look at them twenty-fours inch diamonds spin
Now the D's, they harass me in the 'hood
A few times niggas tried to blast me in the 'hood
Fuck it, it's all good
Catch me in the coupe, on the lean
With needles and samples and diesel for the fiends
The money stay on my mind, so I stay on the grind
Plus niggas like to stun, so I stay with the nine
I ain't the type nigga that be out, runnin' his mouth
Talkin' gangsta and shit, with my gun in the house
Nah, homie, better get to know me better
Before you be leaking pints of blood into your Iceberg sweater
When the talons come flyin' up out the Beretta
You gon' feel like it's your fault and say, ""man, I knew better""
Look, dawg, I don't play that shit
I pull that thing out I'mma spray that shit
That's how I get down

[Verse 3: Brooklyn]
Brooklyn, she's so sick in the hood
Got these fat bitches get the spit in the hood
Cause I throw diamonds, shoot the fifth in the hood
That's what you get for talking all that shit in the hood
Yeah, I'm still a minor, remember this
Everything Brooklyn'll drop you broads'll fall behind her
Brooklyn to Compton, it's all good
Get robbed, get shot, shit is poppin' in the hood

[Chorus: Brooklyn]
I still be ridin' through the hood
Brooklyn to Compton, it's all good
From Southside Queens to Inglewood
We representin' like we should
I still be ridin' through the hood
Brooklyn to Compton, it's all good
From Southside Queens to Inglewood
We representin' like we should",50 Cent,In da Hood,Brooklyn (Aftermath)
"[Verse 1]
Niggas screw they face up at me
On some real shit son they don’t want beef
I cock that, aim that shit out the window and spray
There ain’t a shell left in my heat
Y’all niggas better lay down, yeah, I mean stay down
You get hit with AK round, your ass ain’t gon’ make it
You niggas will get laid out, your blood and your brains out
Have you on the concrete shivering and shaking
I’m from Southside motherfucker, where them gats explode
If you feel like you’re on fire, boy drop and roll
Niggas will eat your ass up, cause they heart turned cold
Now you can be a victim or you can lock and load
The party jump, shorty bouncin that ass, I wanna fuck
Gimme a second I’mma holla, I’mma see whassup
I got my razor in my hand, got my pistol in the trunk
Carve your ass up nice you play me like a punk

[Chorus]
In my hood niggas got love for me
But I don’t go nowhere without my strap
In my hood a little ’dro, a little Hennessy
And niggas just don’t know how to act
In my hood niggas is grimey
I stay on point, I roll with my gat
In my hood niggas might buck at me
So I keep something around to buck back
In my hood

[Verse 2]
I don’t trust a muh’fuckin soul
When the D’s come they fold, on my first case they told
Where I’m from it ain’t safe to have more than a eighth
Niggas’ll come to your place, put a gun in your face
Tell you open the safe, as your heart start to race
Cause a robbery could turn into a homo’ case
Co-operate, or Doc’ll have to operate
Niggas I’ll pop you, run a light then pop at Jake
Trust me son, niggas’ll go hard for that cake
These thirsty niggas are lurking, you’ll have to catch ’em and merk ’em
I’m observing in my hood, cause niggas be dumbing
Shots forfeit the dice game, all you see is the running
They make it harder and harder to pump on the block
I’m a hustler, how the fuck I’m ’sposed to eat when it’s hot?

[Chorus]
In my hood niggas got love for me
But I don’t go nowhere without my strap
In my hood a little ’dro, a little Hennessy
And niggas just don’t know how to act
In my hood niggas is grimey
I stay on point, I roll with my gat
In my hood niggas might buck at me
So I keep something around to buck back
In my hood

[Verse 3]
The house party off the hook until them shots go off
Well that’s what you get for stuntin on my block showoff
You shit out of luck if niggas catch you slippin
Crack money slow so you know niggas is trippin
Shorty down there on that Queens tracks takin a whippin
Sheeit, bitch get out of pocket, she need some discipline
Peep the fiend shootin diesel in his arm in the alley
Look at the chrome spinner spinnin on that black Denali
The grimey niggas where I’m from don’t wanna see you chipped up
You shy nigga on jux, you about to shoot your whip up
It ain’t good to do good in my hood
*Click-clack, blam* You know not to do good now

[Chorus]
In my hood niggas got love for me
But I don’t go nowhere without my strap
In my hood a little ’dro, a little Hennessy
And niggas just don’t know how to act
In my hood niggas is grimey
I stay on point, I roll with my gat
In my hood niggas might buck at me
So I keep something around to buck back
In my hood",50 Cent,In My Hood,
"[Produced by Medi and G Rocka]

[Chorus: 50 Cent]
Nigga, you pussy, you scared
I can hear your heartbeat
Why the fuck would you come around here?
I can hear your heartbeat
Yeah, you know a dog sense fear
I can hear your heartbeat
You bark while we bite around here
I can hear your heartbeat

[Verse 1: 50 Cent]
We ain't cut from the same cloth, we into different shit
I want the bread, you want the bitch
Come out your mouth slick I'll get you hit
My niggas hungry, they hit a lick
Fuck who you're with, niggas'll dump a clip
We by the school yard waiting for you to get your kid
I caught a A1 felony on my last bid
Kept calm, made bond, I'm on that shit
You think my rap shit a gimmick, I ain't seen parole in a minute
Truth be told these niggas is hoes
Once the shit set off, man, anything goes
Through the windows of your soul, the eyes never lie
If you ain't scared to die, nigga, why would you cry?

[Chorus: 50 Cent]
Nigga, you pussy, you scared
I can hear your heartbeat
Why the fuck would you come around here?
I can hear your heartbeat
Yeah, you know a dog sense fear
I can hear your heartbeat
You bark while we bite around here
I can hear your heartbeat

[Verse 2: Jadakiss]
30 something and you ain't never open your mouth yet
Social media is giving cowards an outlet
See him in person, say something, I doubt that
Rather get caught with it than get caught without that
Trying to back peddle and stumble on the curve
You stayin' at the ground, you mumblin' your words
Literally I can see your heart pumpin' through your shirt
Pussy your whole life, you always been a bird
Scared for so long it's all up in your nerves
Screw 9-1-1, you probably call up the reserves
And I'm killin' you first, if we ever do a purge
And you know what it is, kid, whenever we emerge
And I'm tragical, traumatical, no match, incompatible
Nigga, you vaginal

[Chorus: 50 Cent]
Nigga, you pussy, you scared
I can hear your heartbeat
Why the fuck would you come around here?
I can hear your heartbeat
Yeah, you know a dog sense fear
I can hear your heartbeat
You bark while we bite around here
I can hear your heartbeat

[Verse 3: Kidd Kidd]
Money for bail, money to bail
Dead or in jail, Heaven or Hell
FEDs on my coat tail, snitches given court tales
Kept fate when all hope fail
Niggas rattin', all they missin' is the tail like Mickey Mouse
Call me Mickey Mantle when I bat you in the mouth
I bring them hammers out, we ain't trying to build a house
Niggas on them songs rappin' shit they ain't about
I'm from the N-O, we don't scrap, we bang it out
Bang, I'm the one that came in your house for the chickens
Left a nigga brains hangin' out like we chillin'
Stankin' like shipments, over my shillings
Up your security, Rida gang in the building

[Chorus: 50 Cent]
Nigga, you pussy, you scared
I can hear your heartbeat
Why the fuck would you come around here?
I can hear your heartbeat
Yeah, you know a dog sense fear
I can hear your heartbeat
You bark while we bite around here
I can hear your heartbeat",50 Cent,Irregular Heartbeat,"Kidd Kidd, Jadakiss"
"[Chorus: 50 Cent]
The walls have ears lil' nigga, I run New York
Even when I ain't there lil' nigga, I run New York
I said the walls have ears lil' nigga, I hear when you talk
Let's get this shit clear lil' nigga, I run New York

[Verse 1: 50 Cent]
I wake up, stare at the ceilin'
I'm alive, what a beautiful feelin'
I put my vest on right after I put on my drawers
It's a habit I'm always prepared for war
See my life's like some shit, you seen in a flick
Bitches act like pornstars when they sit on a dick
When I was hit and out the game I said ""one more flick""
Test my aim in the range I'm like ""one more clip""
It's my brain, I'm insane, I be on some shit
Man I run Interscope, Jada's tryna annoy me
Nuthin' but another disgruntled employee
He been in the game ten years and he still ain't rich
Even his mama upset that he still ain't shit
And he keep runnin his yap, like I'ma take all that
One more word out his mouth I'll push Style's shit back
See the nozzle on my tre pound is three inches long
And the trigger on the fo' fo's extremly strong
With a little tre douche is like pop, pop
Chase his ass up the block til his bitch ass drop
And the verses he be kickin' none of 'em hot
Cos he ain't got none of that shit he says he got
And he ain't did none of that shit he said he did
And I ain't got time to be talkin 'bout this shit, (fuckin' faggot)

[Chorus - 50 Cent]
I guess it's easy to see lil' nigga, I run New York
Yeah I live in CT lil' nigga, but I run New York
And I don't go to parties lil' nigga, but I run New York
And I stay gettin cheese lil' nigga, cos I run New York
(Yayo, tell 'em I run New York)

[Verse 2: Tony Yayo]
My gun is longer than yours, nigga, call your recouster
LOX made more money than them thin tiny suits
The game around south, drugs and rappin
Jada fuckin punchlines, my serp went platinum
Style's and Sheek Louch went double plastic
Yayo, Buck and Banks was puttin out classics
A hundred shots, a hundred clips, y'all ready to die
Fat Joe ain't a gangsta, he scared to fly
Automatic mossberg, who want a piece of this punk
I had Ja Rule buryed in some high heel punk
Feds stuck in a bullet-proof, man fuck that
Homie, shoot up my whip, you only leave a scratch
Yo, I slip cocaine, in your hotel lobby
And beat you wit my pistol like Caine did Chauncey
It's T.O.N.Y.Y.A.Y.O.,
My whole clique, gotto,my Os on the fly hole
C4s, we fly on linz
And my rocks lookin like, Flex likes yo' benz

[Chorus - 50 Cent]
When I'm down in DC lil' nigga, I tell 'em, I run New York
When I'm out in Philly lil' homie, I run New York
When I'm in VA I tell niggas guess what, I run New York
I'm in NC niggas holla at the moon, cos I run New York
(Yayo tell 'em I run New York)

[Outro: 50 Cent]
Now who the fuck told that lil' nigga he can talk to me like that? Catch my bottle up and roll him somewhere, [laughing] D.Y. wanna talk to me, wanna tell
Me what's goin on. Want me to serve him somethin' for real, cos I'll serve, murder [laughing] eh, eh get Puffy on the phone, tell him I said, tell the
Nigga I said get out the mil for a second let me talk to him. Puffy da only nigga a muthafucka pops, tell him I won't buy the nigga Jadakiss pokes. Nigga
Still ain't a coupe. Ah, nigga, you in da way. You owe money nigga, aw man, now why you make me put yo' business in da street. Now niggas know you ain't
Shit, damn! I see yo' punk ass in da paper, cos you ain't returnin them jewels you borrowed, you better give 'em back, you dirty nigga. Ain't none of that
Shit you be wearin yours. [laughing] We coulda kept this secret, nigga. These niggas I'm supposed to beef wit. Aw man, this fight is fixed, you been set
Up, [laughing] that's what he gonna say, ""they set me up, man."" I ain't even go through that",50 Cent,I Run NY,Tony Yayo
