lyrics,artist,song_title,featuring
"[Intro]
Some niggas just wanna smoke
Some niggas wanna smoke niggas
Some niggas sell coke
Some niggas selling dope, nigga

We all hood, different pedigrees
Now ch-ch-ch-ch-ch-check out my melody
You fuck around I catch a felony
Now ch-ch-ch-ch-ch-check out my melody

[Chorus]
Since a little nigga I been on my own, me I hold the chrome
You don't think so respect it or check it, nigga
That shorty shit is over now I'm grown, me I'm full blown
You don't think so respect it or check it, nigga

[Verse 1]
I don't know if I'm worse when I'm rich or when I'm broke, nigga
Same attitude, you got it, go 'head smoke, nigga
I'm fucking with a blonde bitch, I got my own fragrance
Powered by 50, goddamn it, I think I made it
I tried to keep it basic, they wanna complicate shit
The feds on my phone, that's why I don't ever say shit
Portray being a friend to me and I'll make you a memory
That .40 Cali barrel get to smoking like a chimney
Niggas sick of pussy shit and me I'm just the remedy
'03 get rich, nigga, you remember me?
Shorty rock her hips she get to looking like an entree
Bad bitch, fat ass, bouncing it like Beyoncé
She saying ""I'm a-a diva, I'm a, I'm a-a diva""
I'ma fuck her and leave her, nigga, I don't need her
I was born alone, I die alone, I be in the zone
Bitches won't leave me alone now that my money long

[Chorus]
Since a little nigga I been on my own, me I hold the chrome
You don't think so respect it or check it, nigga
That shorty shit is over now I'm grown, me I'm full blown
You don't think so respect it or check it, nigga
Since a little nigga I been on my own, me I hold the chrome
You don't think so respect it or check it, nigga
That shorty shit is over now I'm grown, me I'm full blown
You don't think so respect it or check it, nigga

[Verse 2]
I pull the hammer out and spank niggas
I peep your style, you got sugar in your tank, nigga
Don't fucking wink at me
I blend in with the best of them, shooters and robbers
I'm on that will.i.am shit, I black your eye for blogging
What the fuck is the problem? Violence isn't the answer
I split your fucking head then get jammed up
Why did you call the cops? Why didn't you say I'm hot?
It's been six years I been here on top
You act like I'm a average nigga spitting a average flow
Fucking with average bitches like everywhere that I go
I'm not focused on hoes, I'm focusing on the dough
And I won't talk to you after my next album blow

[Chorus]
Since a little nigga I been on my own, me I hold the chrome
You don't think so respect it or check it, nigga
That shorty shit is over now I'm grown, me I'm full blown
You don't think so respect it or check it, nigga
Since a little nigga I been on my own, me I hold the chrome
You don't think so respect it or check it, nigga
That shorty shit is over now I'm grown, me I'm full blown
You don't think so respect it or check it, nigga

[Outro]
Rest in peace to Michael Jackson
You niggas need me, man
I might have to start moonwalking
Couple dance moves and shit
Write me some shit, call it ''Billie Jean Is My Lover''
I'm back, nigga, why so quiet?
Niggas know it's summertime, I'm all over the place, nigga
And you know when you see me I'm strizzapped
Oh shit, nigga, y'all know I was gonna get on that shit, yeah",50 Cent,Respect It or Check It,
"[Intro]
G-G-G-G-Unit

[Chorus: 50 Cent]
G-Unit in this bitch right, right, right, right, right thurr
G-Unit in this bitch right, right, right, right, right thurr
G-Unit in this bitch right, right, right, right, right thurr

[Verse 1: 50 Cent]
You like it when she do that right thurr, right thurr
Man, he a trick, he gon' muthafuckin’ pay her, pay her
And I got my trey pound seven right herr, right herr
You can call the cops if you want I don't care, don't care
It’s G-Unit we don't fuckin' play fair, play fair
My shit is mine, yo' shit we gotta share, gotta share
Dogs off the chain my nigga, be aware, be aware
In New York City I'm the muthafuckin' mayor, I'm the mayor
I put a hunnid G's on my neck, like don’t stare, don’t stare
The lights hit the ice, boy your vision might blur, might blur
Bitch get outta line I smack ya ass right herr, right herr
Run and tell who ya want I don't muthafuckin’ care, don't care

[Chorus: 50 Cent]
G-Unit in this bitch right, right, right, right, right thurr
G-Unit in this bitch right, right, right, right, right thurr
G-Unit in this bitch right, right, right, right, right thurr
G-Unit in this bitch right, right, right, right, right thurr

[Bridge: Young Buck]
Young Buck in this bitch right, right, right, right, right herr

[Verse 2: Young Buck]
I snuck in the club wit' a Glock, I got some bud in my sock
Holla fuck the cops, they just mad cause I'm hot
Thugged out, either get up or get the fuck out
Come South, let me show you niggas what Buck ’bout
I ain't scared, you coward bitches better beware
The Source Awards to the billboards, G-Unit there
Here I go, whoever want beef let me know
I ain't one of them artists that's on that P. Diddy show
I can hit you wit' the scope, or hit you wit' some coke boy
Make sure you hit me back soon as you want war

[Chorus: 50 Cent]
G-Unit in this bitch right, right, right, right, right thurr
G-Unit in this bitch right, right, right, right, right thurr
G-Unit in this bitch right, right, right, right, right thurr
G-Unit in this bitch right, right, right, right, right thurr

[Outro: 50 Cent + LeBron James]
Ayo, listen up New York City this the kid 50 Cent
You're now tuned into G-Unit Radio
It's goin' down ya heard me, G-G-G-G-G-Unit
Ayo for all you haters out there, won't y'all check out this new Young Buck",50 Cent,Right Thurr,Young Buck
"[Intro]
I really hate havin’ to resort to knockin’ elderly people in the head for their money
But I do it, I do it
Yea, you know I do it
I’ll do it, I’ll do it
Yep, you know I’ll do it
I like gettin' high

[Hook- 50 Cent (Kidd Kidd)]
I roll the shit, I smoke the shit
(Nigga I’m high as a motherfucker)
I roll the shit, I smoke the shit
(Ain’t not a nigga brother come tell me nothin’)

I roll the shit, I smoke the shit
(I’ll make your bitch come smoke with me)
I roll the shit, I roll the shit
(That’s why you bitch gon roll with me)

My Bentley Coupe ain't got no top
It’s high but I’m checkin’ my AP
If I shine let’s room
Bitch you wanna roll?
Nigga, you must be crazy

I roll the shit, I smoke the shit
I roll the shit, I smoke the shit

[50 Cent- Verse 1]
Hey Slim, hey Shady look what you done did
Made a Southside nigga get a pocket full of bread
Got that Bentley Mulsanne to match that boat
Beige leather seats in it, they match that dope
Kush smoke same color to match that coat
I'm chin-chillin; Mo' spillin
Dom poppin, party rockin
My beat knockin, your bitch watchin
My feds clockin my shit
Threw a grand a piece on all of my kids
Get your ass whipped you step on my shit
Nigga you blink I'm all in yo' bitch
Put her in the club, teach her to turn trick
Jack'll be nimble, Jack'll cum quick
This pimp shit, break the paper off bitch
That shit fake, Audemars don't tick
Them ain't diamonds, what is this shit?
I'm confused, this bill don't go and pick
I'm a match that deal with my hat
They said I fell off, I snapped right back
Nigga my money can't fit in no safe
Got a mil' for e'ry lil' bump on yo' face
Tryin to count mine, I'm walkin up in the vault
Better have a pound if you niggas wan' smoke

[Hook- 50 Cent (Kidd Kidd)]
I roll the shit, I smoke the shit
(Nigga I’m high as a motherfucker)
I roll the shit, I smoke the shit
(Ain’t not a nigga brother come tell me nothin’)

I roll the shit, I smoke the shit
(I’ll make your bitch come smoke with me)
I roll the shit, I roll the shit
(That’s why you bitch gon roll with me)

Get in the coop and got no top
It’s high but I’m checkin’ my AP
If I shine let’s room
Bitch you wanna roll?
Nigga, you must be crazy

I roll the shit, I smoke the shit
I roll the shit, I smoke the shit

[Kidd Kidd- Verse 2]
50 Cent, look what you damn did
Took a ’94 nigga from the hood, made him be
Now every ho want a kid from the Kidd Kidd
They tripped, slipped and fell on my dick
Give me brain like I ain't got no sense
I got change, dollars and lil' cents
I got rich, they ain't seen me since
Now it's all startin to make sense
I pull up in that brand new Benz
All of a sudden I’ve got brand new friends
Brand new chopper, bitch go blocka
BRRRRRT, like I just broke wind
(I roll the shit, I smoke the shit)
I forgot she was in my bed
(I roll the shit - I smoke the shit)
Damn! I blew through all my bread
That Lambo ain't got no top
Man, I'm hotter than a stove top
Rider Gang, we on top
And we havin a smoke-out
Eyes low but I'm so high
Don't ask me, I don't know why
I'll roll the shit and I'll smoke the shit
If I don't pass the shit don't task for shit, HUH!

[Hook- 50 Cent (Kidd Kidd)]
I roll the shit, I smoke the shit
(Nigga I’m high as a motherfucker)
I roll the shit, I smoke the shit
(Ain’t not a nigga brother come tell me nothin’)

I roll the shit, I smoke the shit
(I’ll make your bitch come smoke with me)
I roll the shit, I roll the shit
(That’s why you bitch gon roll with me)

Get in the coop and got no top
It’s high but I’m checkin’ my AP
If I shine let’s room
Bitch you wanna roll?
Nigga, you must be crazy

I roll the shit, I smoke the shit
I roll the shit, I smoke the shit",50 Cent,Roll That Shit,Kidd Kidd
"[Intro]
I'm on parole, I used to be on probation
I'm with my gun, I get full coporation
I tell you ""Take it off"" no hesitation
Nigga you play around, I lay you down
That's how it's going down
Don't play with me, I don't have patience
My head achin', and I need my medication
Niggas be hatin', they don't know what they facing
Nigga you play around, I lay you down, that's how it's going down
I be in court throwing signs like I'm a mason
Nigga witness against me, I'mma erase 'em
If they try to run away, I'm gon' chase 'em
Now or at the town, and I'mma lay 'em down
That's how it's goin' down

[Hook]
Better watch how you talk, better watch where you walk
On the streets of New York, that's how we get down
22's on the jeep, some deep in the seat
When we creep with the heat, that's how we get down

[Verse 1]
Wise men listen and laugh while fools talk
Stick up kids don't live long in New York
Fuck around and catch the wrong jukes on the street
Get caught slipping, then get hit with like three
In every hood in the US, I'm that nigga they feeling
Rap full of good guys, 50 Cent is the villain
I play the bar with eight bottles all night getting right
Teaching the hoodrats what Cristal taste like
I put 60 on my wrist, 12 on my fist, 100 on my neck
We in the hood nigga scheming, what you expect?
My S on 22's leave ya hoes confused
On the track ready to choose, like ""Daddy, we want you""
My love live ain't change, the shorties still hug me
Bullet wound in my face, and bitches still love me
Now Nelly told you how them country boys talk
I came to teach you how we put it down in New York
That's how we get down

[Hook]
Better watch how you talk, better watch where you walk
On the streets of New York, that's how we get down
22's on the jeep, some deep in the seat
When we creep with the heat, that's how we get down

[Verse 2]
In the city, a young buck'll tell you how the mac spit
O.G. give 'em the word, you gonna get your ass hit
I don't know why niggas like to talk bad about me
I'm the richest nigga they know without a G.E.D
Man it could be the money, it could be the ice
It could be they'd like to be me and can't live my life
You should hear they be saying man ""50 be flipping""
""Shot my man over seven grams, that nigga be tripping""
I know death is promised, I don't fear getting murked
It's when a nigga half-way kill ya homie, it hurts
Now we can hit the club and get it crunked
Or you could start some shit, and I could hit you with the pump
You can have it how you want, but I know you like my style
Uh-huh, you like how I break it down
Wanna get rich? I'll show you how
Take this pack, pump these pieces, that's how we get down

[Hook]
Better watch how you talk, better watch where you walk
On the streets of New York, that's how we get down
22's on the jeep, some deep in the seat
When we creep with the heat, that's how we get down",50 Cent,Rotten Apple,
"[Hook]
Yo LA niggas are the rowdy niggas
New Orleans niggas is rowdy nigga
D.C. niggas is some rowdy niggas
New York Niggas is the fucking wildest nigga

[Verse One]
Yo, your man could have ran when I robbed him but he froze
Son I ain't even rock him to sleep, the nigga dozed
The bitch could have helped you get rich, but she chose
Now you heartbroke, that's what you get for lovin them hoes
An ill flow with no beat, is incomplete, it's like a stickup kid
Runnin round without no heat, it like a fifth with no kick
A fiend with no hit, a willie with no wit
A bad bitch that won't blow dick
It's like a rollie with no ice, a gamblin spot with no dice
Like fuckin supermodel bitches and not bustin off twice
I murda any mic device, for the right price, I'm nice
I only say things once, never twice, dont fuck with me

[Hook]
St. Louis niggas is rowdy rowdy
Cleveland niggas is bout it bout it
50 cent ain't gonna kill ya nigga, don't get doubted
Got your gun, well don't leave home without it
Them Memphis ballas is rowdy rowdy
Them [Chi]-town cats is bout it bout it
They'll kill you and act like they don't know shit about it
Leave your body somewhere where no one can find it

[Verse Two]
Now if I pull out the gat and just push your wig back
I bet niggas will stand around sayin ""Damn who did that?""
I'm the type nigga to dare you to touch the [Jack]
I'm the type to borrow your gat and won't give the shit back
I'm F to the I - F -T - Y - C - E - N - T
Caress your girl gently in back of the Bentley
You thought she was pimpin, son I was in the Hamptons
In a heart shaped hot tub with the bitch lampin
I plan to take over New York and start expandin
Was Bob Marley singin about tecs when he sung ""I'm Jammin'""
Nigga fuck with my cash and I'mma blast yo' ass
Smash the Glock out the stash in the dash an [mash]
Flee in a flash, lay low let time go past
If you survive the shots I'mma find yo' ass
Put the gat to your head and remind your ass
I ain't playin with you, I want my money motherfucker

[Hook]
The VA cats is rowdy rowdy
Them Carolina niggas is rowdy rowdy
If they say they gon' kill you nigga, don't you doubt it
Got your (gun), well don't leave home without it
Them ballas out in Philly is rowdy rowdy
Them Oakland cats is rowdy rowdy
They'll body you and act like they know nothing about it
Leave your body somewhere where no nobody can find it

[Verse Three]
Yo, some nigga just shot the block up, god (Word?)
He had the same shit you got on, dog (Word?)
I know you done did it so get the fuck up outta hear, ya heard?
I run with niggas that spray and strip and say that shit
You won't let us pump on your block, fuck it, we makin it hot
I'm that nigga that call the shots, with the iced out watch
From the cordless cell phone, and the baby blue drop
I got a lot of hungry niggas with me straight from the street
These industry cats are startin to look like something to eat
They got watches on they wrist that cost like 60 thousand
My niggas live in section eight in public housing
They murder you and keep shit low cause niggas heard of you

[Hook]
Them B-More cats is rowdy rowdy
Them Detroit ballas is rowdy rowdy
If they say they gon' wet you boy, don't you doubt it
Got your gun, well don't leave home without it
Them ballas in Miami is rowdy rowdy
Them Oakland cats is rowdy rowdy
They'll body you and act like they know nothing about it
Leave your body somewhere where no nobody can find it

Them Jersey cats is rowdy rowdy
Them Boston ballas is rowdy rowdy
If they say they gon' wet you boy, don't you doubt it
Got your gun, well don't leave home without it
Rowdy rowdy! Bout it bout it",50 Cent,Rowdy Rowdy,
"[Intro]
Yeah
Yeah we can ride to this
Just lay back and cruise

[Verse 1]
Here's a taste of my life, it's bitter and sweet
I pour my heart out to the sounds of the drums and the beat
I put my life on the line when I'm out on the street
Put my Teflon on, and roll with my heat
I keep my circle nice and small, I don't fuck with these clown niggas
In the race for the cheese I run laps around niggas
Soon as I step on stage, the crowd applauds
Soon as my sneaker went in stores, Reebok stock soared
I ain't gotta say I'm a boss, niggas could tell
The East coast crib the size of a small hotel
The shit journalists write about me leave me confused
Have me feelin' like the heavyweight champ when he lose
I read somewhere, I'm homophobic, shit
Go through the hood, there's mad niggas on my dick
Now we can get hostile, or we can do this smooth
TNT around, I can still make blow move

[Chorus]
This is what you call rider music
All the gangsters are ridin' to it (c'mon, let's roll)
I can show you how we do it
When we ride to that rider music, let's go (let's go)
This is what you call rider music
All the gangsters are ridin' to it (c'mon, let's roll)
I can show you how we do it
When we ride to that rider music, let's go

[Verse 2]
Last year I woke up with good luck, damn it feels good
On the low, I done fucked like half of Hollywood
Had yo favorite actress, from yo favorite shows
In my favorite position, you know how it goes
And my Bentley bumpin' Prince shit, this is When Doves Cry
This is what it sounds like when hollow-tip slugs fly
Homie this is somethin' you can ride and smoke to
Stay on point, cause niggas will ride and smoke you
Jealousy's for women, but some niggas is bitch made
They make you wanna run across they head with a switchblade
They point the finger at me, sayin I'm bugged
My flow's crack, you listen, your fuckin' brain's on drugs
Look ice drippin' on my neck, hands grippin' on a TEC
Fool trippin' threw a set, you can get yo ass wet
Cards messin' up my deck, screws loose show respect
You try to come at me kid yo ass better come correct

[Chorus]
This is what you call rider music
All the gangsters are ridin' to it (c'mon, let's roll)
I can show you how we do it
When we ride to that rider music, let's go (let's go)
This is what you call rider music
All the gangsters are ridin' to it (c'mon, let's roll)
I can show you how we do it
When we ride to that rider music, let's go

[Verse 3]
My mama gave birth to a winner, I gotta win
Pray the Lord forgive me for my sins (uh-huh), I'm still thuggin'
Cruisin', rims gleamin' like the stones on my wrist
Zonin', guess this is how it feels to be rich
Homie, you hustlin' backwards if you chasin' a bitch
Stupid, chase the paper they come with the shit
I'm fallin', in love with success
Entrepreneur, connoisseur, I maneuver the best
Rollin', Ruger on my lap, rubber grip on the handle
Stunner have your homies burnin', rest in peace candles
As wise men speak I listen and learn
A man dies, a baby's born, my nigga the world turns
Rappers I make 'em sick, when I say I'm the shit
They mistake my confidence for arrogance, they hate on the kid
In '99, I had a vision and made a decision
Bein' broke is against my religion
Now I'm caked up - what?

[Chorus]
This is what you call rider music
All the gangsters are ridin' to it (c'mon, let's roll)
I can show you how we do it
When we ride to that rider music, let's go (let's go)
This is what you call rider music
All the gangsters are ridin' to it (c'mon, let's roll)
I can show you how we do it
When we ride to that rider music, let's go
This is what you call rider music
All the gangsters are ridin' to it (c'mon, let's roll)
I can show you how we do it
When we ride to that rider music, let's go (let's go)
This is what you call rider music
All the gangsters are ridin' to it (c'mon, let's roll)
I can show you how we do it
When we ride to that rider music, let's go",50 Cent,Ryder Music,
"[Intro: 50 Cent]
Yo, niggas be asking me ""Yo 50 who you got beef with?""
Ima tell y'all niggas who I got beef with
I got beef wit any nigga I can't make no money wit
If I can't make no money wit you, fuck you nigga
G-Unit nigga, that's what's up cause I said that's what's up

[Verse 1: Tony Yayo]
I get money, money I got
So its a 100 grams or better when I'm going to cop
I never hold the toaster cause I use my little soldier
And my down bitch as a holster, like I'm supposed to
Heavy pistol shells'll lift you
My gun tear through lungs and rip through tissue
While I'm out for amends, you out for a rep
That's the same thing that have yo mama in a black dress
See me in a black Lex, hard-top
My mink drop-top, fresh out the car lot
I got the gift of raw pugilist speeches
So I'm gon sell like the box office features
Niggas in the hood can't see G-UNIT!
But deep in they heart they wanna be G-UNIT!
Cause we got them three B's: Benzes, burners, and bitches
And plus we on the road to the riches

[Hook: 50 Cent]
You can say what you want about me
As long as you don't get in the way of my money
Cause all that talking shit to me played out
Nigga keep bumping your gums you get laid out
You can say what you want about me
As long as you don't get in the way of my money
Cause all that talking shit to me played out
Nigga keep bumping your gums you get laid out

[Verse 2: Lloyd Banks]
Lately, I been going through a phase
Hope they ain't tap the phones
Cause we got pumps the size of saxophones
Therefore I'm on the move with the squad
I'm stingy as ever, known to trick fast food on a broad
Picture me putting jewels on a broad
I'd rather put shoes on the car
And a pool in the yard
You don't really wanna fool with the god
Nigga my front line long enough to fill two boulevards
In this game, you only make it far if you loyal
And if you grew up with your mother and your father you spoiled
Why swing? You gotta be strapped to get rid of me
I'll leave you in water like the Statue of Liberty
I'm tryin to be cool
Blowin green that strong enough to make a white boy open fire on a school
Keep rappin' for your hood, I'm rappin' for Benzes
And long assault rifles with straps on the lenses

[Hook: 50 Cent]
You can say what you want about me
As long as you don't get in the way of my money
Cause all that talking shit to me played out
Nigga keep bumping your gums you get laid out
You can say what you want about me
As long as you don't get in the way of my money
Cause all that talking shit to me played out
Nigga keep bumping your gums you get laid out

[Verse 3: 50 Cent]
Yall niggas gotta learn from me (Yeah!!)
What I learned from Gotta Rock and Spank G (Un-Huh)
Yall niggas gotta learn from me (Yeah!!)
What I learned from watching Brucie B
Look, I shot the sheriff
And nigga if you get too close yo punk ass getting shot
Here's the plan, I'm a keep stackin' my ends
Till I'm on airplane seats in the Maybach benz
I'm all about the chips
I done took them trips
22's on the 6
26 on the bricks
And them outta town niggas, I'm chargin' yall more
I tapdance on the shit I ain't servin' it raw
You sell smoke, look, nigga, I got what you need
But it ain't goin' cheap I got mouths to feed
Niggas always sayin' damn 50 you bugged
Cause I got hoes giving niggas the date rape drug
Gimme his watch and his chain
We not the same, he a lame
He want pussy I'm bout my money man
Crap table in Vegas had his bitch on my dick
Threw a 7 so many times they thought the dice was fixed
Yo it's 50, when your mindframe change and start to rearrange
I'll see you another day motherfucker it's 50
Shots 'til your heart drop and freeze up, ease up motherfucker

[Hook: 50 Cent]
You can say what you want about me
As long as you don't get in the way of my money
Cause all that talking shit to me played out
Nigga keep bumping your gums you get laid out
You can say what you want about me
As long as you don't get in the way of my money
Cause all that talking shit to me played out
Nigga keep bumping your gums you get laid out",50 Cent,Say What You Say,"Tony Yayo, Lloyd Banks"
