lyrics,artist,song_title,featuring
"[Intro]

[Verse 1: Scarlett]
Picture me rolling Range Rover
Same color your Air Force Ones
White on white, ya like?
Red I Flight the night
From L.A. to N.Y
I'm Harlem bound
You see how bitches tense up, when Scarlett 'round
Niggas get the heart to holla while we up in the club
But get intimidated when they see me sitting on dubs
I hear 'em whispering "" dat ain't a man, shit that's her.""
She roll with them G Unit niggas, that's what's up
Disrespect me, I'll have niggas blast ya up
Take my advice, don't let ya peoples grass ya up
I got a fetish for the chips
20's for the six
Hollows for the clips
Try me, if you think I'm playing bitch
And the police we'll have another crime scene taker
Jim Star crush your head, give your ass a shape-up
Uptown niggas known for the money they make
Everybody ain't shook, you see doing the shake

[Chorus: 50 Cent]
The boss spending ends
Saying, ""Gimme that Benz, 20 inch rims, and four TV's""
The snitch in the precinct saying
""He sell X, he sell techs, and he sell D""
The balla by the bar saying
""Everybody drink, the best champagne, it's all on me""
Snitch in the back of the police car
Pointing out the window saying, ""He robbed me""
It's elementary

[Verse 2: Lloyd Banks]
Now get the fuck on the floor
I slid through the front door
With the 9 and the velour
A cal in my pocket
You wil', I'mma pop it
I'm down for a profit
I'm ghetto as hell
You can't you tell?
My road dog, under the jail
Getting frustrating mail
So I'm drinking and smoking
Thinking and hoping
This cell gon' open
You can dance next to me, but don't throw an elbow
I'll throw one back and leave blood on your Shell Toes
Hell no
I ain't paying for pleasure
Your pussy don't bring rainbows and pots of treasure
It's every girl's dream, to floss with the team
Long on the suine
DVD's on the screen
Blowing on cream
Waiting for you to scheme
You ain't gotta know how to read, to spray a magazine

[Chorus: 50 Cent]
The boss spending ends
Saying, ""Gimme that Benz, 20 inch rims, and four TV's""
The snitch in the precinct saying
""He sell X, he sell techs, and he sell D""
The balla by the bar saying
""Everybody drink, the best champagne, it's all on me""
Snitch in the back of the police car
Pointing out the window saying, ""He robbed me""
It's elementary

[Verse 3: Tony Yayo]
I don't wanna grow up, I'mma hustler kid
Go'head and stunt, see I don't pop two your wig
I'm artistic, intelligent, so much ability
When I use them big words, your bitch be feeling me
So ya'll niggas hate me, cause your wives be our groupies
Ya'll irritate me, like loud people in the movies
Fall back, matter fact back down
Cause I just passed security without no pat down
You can catch me in the bathroom blowing a sticky
Or catch me on the dancefloor feeling some tits
Sex sells, so I'mma P-I-M-P
So my pockets never be empty
It ain't no problem, we scoop them models
We got condoms, coups, and lavish condos
50 got me getting ass like I never did
So when I step in the club, hoes love the kid

[Chorus: 50 Cent]
The boss spending ends
Saying, ""Gimme that Benz, 20 inch rims, and four TV's""
The snitch in the precinct saying
""He sell X, he sell techs, and he sell D""
The balla by the bar saying
""Everybody drink, the best champagne, it's all on me""
Snitch in the back of the police car
Pointing out the window saying, ""He robbed me""
It's elementary

[Outro: 50 Cent]
The cat in the house go
Meow, meow, meow, meow, meow, meow, meow, meow, meow
The bird in the cage go
Tweet, tweet, tweet, tweet, tweet, tweet
It's elementary",50 Cent,Elementary,"Lloyd Banks, Tony Yayo, Scarlett"
"{*song borrows beat & samples from Hi-Tek & Talib Kweli's ""The Blast""*}

[50 Cent]
Ga ga G-Unit! (body) haha, yo, yo

I need no introduction, everybody (body)
Heard of 50 Cent, and heard of G-Unit
I'm not Hi-Tek and I'm not Kweli (Kweli) - you see me in the club
You better tell the bouncers to treat me special, I'm somebody (body)
Cause I get on that jet, in 5 minutes flat
Niggas'll come back, shoot up your party (party)
If I don't have fun, nobody havin' none
I'm tryin' to holla at ya, come here shorty (shorty)
Shout out to my nigga Juvie, Wacko's here
Buck, my niggas from New Orleans, wodie (wodie)
If we on the same page, when you see me on stage
You gonna throw your hands up, and you gonna applaud me (plaud me)
You know how I get, I'm still on that bullshit, nigga, nigga

[Tony Yayo]
I run around with the trey (body) pound like its a sport
And call my name in the bench, while I sit in court
I got a million dollar smile (body), and a fist full of pesos
And the wrist so icey, it could light up a stage show
In the club (body), nigga I stay holdin'
Cause I'm on point for them wolves, and sheep clothin'
I play the bar (body), with a double shot of Henny
Cause after this spot, its cheaters, and envy
(Shorty if you feel a nigga, call me) (body)

[Lloyd Banks]
Yeah, Banks, yeah
Look you ain't got to like me, that's (body) cool, I don't give a fuck
Clowny time ain't gonna put me in a bigger truck
Fuck kids, it (body) ain't my turn to be stressed
A bitch worse nightmare is a paternity test
I'm too young to be faithful (body)
If money means love, I hate you
I only trick on the first of April
Holla at me, if you thugged (body) out shorty ready to fight you
Dice, roll a blunt, and pull the snub out for me
And if your not don't even (body) call me

(*gun shot fired, yelling*)",50 Cent,E.M.S.,"Tony Yayo, Lloyd Banks"
"[Intro: 50 Cent]
N-Y, N-Y, 'til I D-ie
N-Y, N-Y, 'till I D-ie

[Hook: 50 Cent]
I'm on it
Everytime I come around, me I keep my gun around
It's never on safety
I'm on it
Niggas know when I'm around, fuck around it's goin' down
No if's or maybe's
Ring around the rosies, pockets full of OZ's
Niggas gettin' cake made
Fuck with the homies while I got it on me
You'll get your big break, man

[Verse 1: 50 Cent]
You niggas ain't seen shit yet, one false move and I click clack
That oo-wop bitch I spit that, that hard white I flip that
That bad bitch get my dick wet, damn how hot can my shit get?
Boy, get outta line get your ass checked, got 10 mil' my last check
Bitches stay where that cash at, diamonds on me I flash that
That 'Rari pedal I mash that, you pussy niggas I laugh at
That fuck shit that you fuck niggas be doin', man, I'm passed that
Hood nigga down there on Wall Street, my stock run across NASDAQ
Girl face on my time piece, ridin' around with my crimeys
These broke niggas so grimy, I let 'em hold the steel, I tell 'em shoot to kill
I put south side on my back, I ain't talkin' 'bout no tat'
When I'm outta town I hold it down, I mean everywhere I'm at

[Hook: 50 Cent]
I'm on it
Everytime I come around, me I keep my gun around
It's never on safety
I'm on it
Niggas know when I'm around, fuck around it's goin' down
No if's or maybe's
Ring around the rosies, pockets full of OZ's
Niggas gettin' cake made
Fuck with the homies while I got it on me
You'll get your big break, man

[Verse 2: Kidd Kidd]
All my niggas crazy stupid, cuckoo, got a loose screw
I might pew pew with that two-two then small bullets will mob through you
My bitch come from Honolulu with that dope ball in her doo doo
Put it on a train and choo choo and the feds don't have a blues clues
Thumbing over, don't know voodoo but I sure know how to shoot you
If I get caught I don't boo-hoo, I pick up the phone call BooBoo
He gonna bail me out in seconds, please don't let this rap shit fool you
I send shooters to your home, see I don't need no songs to move you
My gorilla goin' ooh-ooh, boy your family could lose you
Put you in a box like new shoes, you's a bitch pull down your tu-tu
When it come to gettin' money all I know is we need bookoo's
Speakin' only in my Ryda Gang, know what we gonna do to you

[Hook: 50 Cent]
Everytime I come around, me I keep my gun around
It's never on safety
I'm on it
Niggas know when I'm around, fuck around it's goin' down
No if's or maybe's
Ring around the rosies, pockets full of OZ's
Niggas gettin' cake made
Fuck with the homies while I got it on me
You'll get your big break, man",50 Cent,Everytime I Come Around,Kidd Kidd
"[Intro: 50 Cent]
We over here... with some fat chicks
Nah, I don't be fuckin wit them fat bitches
That's Yayo

[Hook]
Don't be stuck on the things they say
Now you know it's a nasty world (you know it's a nasty world)
I ain't fuckin wit you anyway
Cause I know your a nasty girl (know your a nasty girl)
I ain't never gon discriminate
So let me compliment your eyes (compliment my eyes)
Yeah, It's nothin' but a little baby phat phat

[50]
Them Twinkies got your ass gettin' fat fat
Them cookies got your ass gettin' fat fat
That paint got your ass gettin' fat fat
Bitch you grown, that ain't baby fat fat

In the gym I see your ass up on the stair master
But you got it on level 2, bitch go a little faster
Look girl I ain't gon lie, I'll tell you how I feel
They should hand cuff your big ass to the treadmill
You wanna work out now, cause you know its gettin' hot
And your big ass fin to pop all up out the halter top
Find the right chick, wearing some tight shit, and it's on
See your ass wearing some tight shit, we like ""She wrong""

[Hook]
Don't be stuck on the things they say
Now you know it's a nasty world (know it's a nasty world)
I ain't fuckin wit you anyway
Cause I know your a nasty girl - You's a nasty girl (know your a nasty girl)
I ain't never gon discriminate
So let me compliment your eyes (compliment my eyes)

[50}
Yeah, you got some nice eyes, but you's a big bitch man
Yeah, It's nothin' but a little baby phat phat
That Burger King dun got your ass fat fat
McDonald's dun got your ass fat fat
That Dominos dun got your ass fat fat
Yeah, It's nothin' but a little baby phat phat

[Lloyd Banks]
I like 'em slim in the waste, curves in the right place
A bitch wit hips, lips, and a nice face
Your appetite'll put a dent up in a nigga salary
You need to stop burnin that weed, and burn a calorie
Your attitude is like you always have gear
You got a pony tail, you ain't always have hair
I just wanna see your Capri's comin' down
Mami we run the town, stay away if you 300 pounds

[Hook]
Don't be stuck on the things they say
Now you know it's a nasty world (know it's a nasty world)
I ain't fuckin wit you anyway
Cause I know your a nasty girl - You's a nasty girl (know your a nasty girl)
I ain't never gon discriminate
So let me compliment your eyes

[50]
I'll say something nice about ya eyes, cause you's a big bitch man
Yeah, It's nothin' but a little baby phat phat
Them Entenmann's dun got your ass fat fat
Them Little Debbie's dun got your ass fat fat
These cup cakes dun got your ass fat fat
Yeah, It's nothin' but a little baby phat phat

[Tony Yayo]
I ain't no trick, I ain't have to borrow with my wallet
Freakin' off in your car, on your closet
It ain't nothing wrong wit a big, strong girl
If you can cook your ass off, I'll give you the world
You can be skinny or fat, white or black
Nigga pussy is pussy so, yeah, I'll hit that
I'm a freak, sure I love minage a trois
And I really care lees if you twice my size

[Hook]
Don't be stuck on the things they say
Now you know it's a nasty world ' It's a nasty world
I ain't fuckin wit you anyway
Cause I know your a nasty girl - You's a nasty girl
I ain't never gon discriminate, so let me compliment your eyes

[50]
I'm a compliment your eyes
Yayo'll fuck wit you big bitches but I'm a stay the fuck away from ya

Them Twinkies got your ass gettin' fat fat
Them cookies got your ass gettin' fat fat
That paint got your ass gettin' fat fat
Bitch you grown, that ain't baby fat fat

Stay the fuck away from, you fuckin fat bitch
Fuck wit Tony Yayo, ho",50 Cent,Fat Bitch,"Tony Yayo, Lloyd Banks"
"[Produced by Dr. Dre]

[Verse 1: 50 Cent]
I make it hotter,  friction turns to fire
You're what I desire, I'm coming to get you, girl
That's right, that's right, it's on tonight
You're just my type, you're what I like
I bring that heat, you heard me right
Everywhere I go, go, let's go
Something new, it's another episode
Music bumping, sweat dripping on the danceflo'
I like it when shorty get to backing it back
When she do it like that, I don't know how to act

[Bridge]
Now work it
Go ahead grind it on me, that's perfect
I'll pay to play if it's worth it
My phone when you want me you can chirp it
Now get to work, kid

[Bridge: Young Buck]
Let me take these bricks and break 'em down
If you want I can serve 'em by the pound
Shorty know she's got what I wanna flip
Baby girl tell me you can handle it

[Hook: Nicole Scherzinger]
Wel, if you want it let's go
I got that fire (So hot I burn it down)
Act like you already know
I got that fire (Cause I'm the flyest chick around)
You want it, it's fire, I got it, that fire
So I might ignite ya, it's fire, it's fire

[Verse 2: 50 Cent]
I burn it down on stage, I make it hot
'Til the Fire Marshall come shut down the spot
I have the club jam packed everytime I rock
These other niggas ain't got the style I got
I go back to the basics and break it all the way all the way down
You can hate it but face it B.I.G. and 2Pac just ain't around
Everywhere you go, there I go, I'm 50 Cent
Ghetto star by the bar I get you bent
You wanna party, let's party, you wanna freak be a freak
You wanna creep we can creep tell me where should we meet
So you can

[Bridge: Young Buck]
Take these bricks and break 'em down
If you want I can serve 'em by the pound
Shorty know she's got what I wanna flip
Baby girl tell me you can handle it

[Hook: Nicole Scherzinger]
Wel, if you want it let's go
I got that fire (So hot I burn it down)
Act like you already know
I got that fire (Cause I'm the flyest chick around)
You want it, it's fire, I got it, that fire
So I might ignite ya, it's fire, it's fire

[Verse 3: 50 Cent]
Now are you really ready
I said, are you really ready
I make the temperature rise, now don't be surprised
I have the ice on, stuntin heavy
I got a helluva flow, you should already know
Sold over 30 million records already
It's the third time around, you know how I get down
I'm hands down, pound for pound, the best around

[Bridge]
Now work it
Go ahead grind it on me, that's perfect
I'll pay to play if it's worth it
My phone when you want me you can chirp it
Now get to work, kid",50 Cent,Fire,"Young Buck, Nicole Scherzinger"
"[Intro]
From the day you're born 'til the day you die
If you're one of the poor ones you just gotta work hard

[Hook]
One-eighty-seven, one-eighty-seven
Departure from the hood, destination hell or heaven
One-eighty-seven, one-eighty-seven
Departure from the hood, destination hell or heaven
I'm a rider, say I'm a rider
I'm a rider, say I'm a rider
I'm a rider, say I'm a rider
I'm a rider, say I'm a rider

[Verse 1]
They putting pressure on me, son, now they want me to snap
End up like X and Whitney in my mansion smoking crack
I'm paranoid, I'm feeling like niggas is trying to get me
Forget the kids, I'm shaving off my fucking head like Britney
Man, Dre won't mix my records, now I need to talk to Jimmy
I'm falling back in my old ways, I'm riding with the semi
Who's calling me? It's Chris, he's on the other line with Diddy
But I don't wanna talk right now, my day is going shitty
Why's Jay rocking that Urkel look, man, isn't he from Marcy?
They say he's growin dreads and now he's talking like a Yardie
Man, everything is changing, I don't understand a thing
I guess this is that bullshit that all the money brings
I'm on flight

[Hook]
One-eighty-seven, one-eighty-seven
Departure from the hood, destination hell or heaven
One-eighty-seven, one-eighty-seven
Departure from the hood, destination hell or heaven
I'm a rider, say I'm a rider
I'm a rider, say I'm a rider
I'm a rider, say I'm a rider
I'm a rider, say I'm a rider

[Verse 2]
My baby mama boyfriend like to talk like he can hurt me
I'm laughing cause she kissed him in his mouth and gave him herpes
That just makes him one of 50 niggas wanting to murk me
Niggas found my truck and burnt it up out there in Jersey
You can ask my son, he'll tell you ""my dad's fucking crazy""
She filled his head with shit and now I think he fuckin' hates me
Shady didn't invent me but a star is what he made me
I'll blow your fuckin' mind out if I told you what he paid me
He gave me all the pills he had left, that's why I'm so high
It makes me feel so good now that I'm not so scared to die
I wish a nigga would, I dare a motherfucker try
You get at me and miss you kiss your black ass good-bye
I'm on flight

[Hook]
One-eighty-seven, one-eighty-seven
Departure from the hood, destination hell or heaven
One-eighty-seven, one-eighty-seven
Departure from the hood, destination hell or heaven
I'm a rider, say I'm a rider
I'm a rider, say I'm a rider
I'm a rider, say I'm a rider
I'm a rider, say I'm a rider

[Verse 3]
My lawyers on retainers every month, I give ‘em stacks
In case they wanna send me up for murder like Max
Man I wasn't the shooter, I was never on the scene
So if they do forensics they'll find out it wasn't me
There's no need for a lie detector, I ain't sayin shit
The more you talk the higher chances you're doing a bid
Today I read the paper, it said Tru Life caught a case
They said they found a victim with a knife stuck in his face
I spoke to Michael Vick, I told him I'm happy he home
You tell them crackers sorry nigga then you get back on
When dogs are fighting in the hood nobody gives a fuck
So you get back and shake it on the field, show them what's up
I'm on flight

[Hook]
One-eighty-seven, one-eighty-seven
Departure from the hood, destination hell or heaven
One-eighty-seven, one-eighty-seven
Departure from the hood, destination hell or heaven
I'm a rider, say I'm a rider
I'm a rider, say I'm a rider
I'm a rider, say I'm a rider
I'm a rider, say I'm a rider",50 Cent,Flight 187,
"[Intro: 50 Cent]
50, uh
ScHoolboy Q
Haha

[Hook: 50 Cent & ScHoolboy Q]
Smiling...?
Nigga you gon' make me Flip On You!
You gon' make me flip this knife out do some shit to you!
Nigga you gon' make me Flip On You!
Nigga you gon' make me-you gon' make me Flip On You!
Nigga you gon' make me Flip On You!
You gon make me pull the strap out, do some shit to you!
Nigga you gon' make me Flip On You!
Nigga you ain't gon' be moving when this clip is through!

[Verse 1: ScHoolboy Q]
Nigga, I'm the one that bought all them bitches out
Got a G-A-T this MVP don't run his mouth, nigga
You gon' make me fill this clip for you
You gon' make me unload then reload 'em number 2
Nigga, I've been known to get them Oxys off
I believe in God, but cross my heart this nine go off
Nigga, I'm from the Mecca of the Groove
The Hoover Crip, I grew up on Figg I had to dodge them County Blues
Live my life behind the rules
Running from the cops, smash the rocks up under my shoes
Spit out the eighth that once, hid in my face
Bounce spring over the gate, didn't get caught
I guess my escape, nigga was fate
I love the block and all the dogs that kept me safe
Now it's, back to adding, points to the crime rate
Get slumped in your drive way
You gon' make me hurt your boy
You gon' make me put that work in boy
You gon' make me get to murkin' boy

[Hook]

[Verse 2: 50 Cent]
Focus on money, I'm in and out ass fast
She loosen up against the wall like a NASCAR crash
Got a bunch of enemies, I count my friends on one hand
Ghetto philosphy, watch me, I got a hundred scams
Like we could make a few dollars, that there a hundred grams
I got a gift, I communicate with the afterlife
Apparently, your bitch ass ain't acting right
Niggas killed your man, you ain't gon' get him back?
What? You is tired out? Why you ain't get around to that?
You wander, I travel, I have a destination
I'll be a street legend new version of Pappy Mason
My style? It'll never die, boy I'm immortal
You shoot me down, I'll get back up and keep coming for you
Man on fire, hitman for hire
Them niggas got happy they thought I was gon' retire
Now they bitch giving me head, I'm the man, a man admires
What's up?

[Hook:]",50 Cent,Flip on You,ScHoolboy Q
"[Intro: 50 Cent]
Yeah, Sha, you're ready, drop that, Ferrari F50 style baby
I'ma show them how I do it, G Unit

[Verse 1: 50 Cent]
I keep hearing niggers' is happy, the D's come, niggers' with guns
When I'm out on bail, riding with some new ones
Big got hit in that passenger seat
Pac got hit in that passenger seat
Now I'm riding around in that passenger seat
Come near the whip, I'm blasting my heat
It don't take long for my juvenile delinquent thinking to sink in
The consequences mean nothing, them semi auto's is busting
Crack selling, predicate fellon, spit big words, but I can't spell them
Put a shot to your melon
That help your punk ass from telling
That I got that nine and that four four, the H2 on double four's
Bulletproof windows and doors, gangster, how about yours
'Southside' tatted on my back
My last gun shipment got the whole hood strapped
Now all I got is two three eighties' and a nine
Nigga, you can knock and tell the cops, but you're dying

[Chorus: 50 Cent]
You're thicker than water, ouch, twizzy wizzy wa
You're thicker than water, ouch, twizzy wizzy wa
You're thicker than water, ouch, twizzy wizzy wa
You can be a Blood or a Crip, nigga, bitch, follow me
You're thicker than water, ouch, twizzy wizzy wa
You're thicker than water, ouch, twizzy wizzy wa
You're thicker than water, ouch, twizzy wizzy wa
You can be a Blood or a Crip, nigga, bitch, follow me

[Verse 2: Tony Yayo]
I used to chill in the hood to support the fiends
But, now I'm eating caviare instead of pork and beans
I'm in the money green seven forty-five with seven shots in the four five
Y'all niggers' want to die
I've got a love affair with violence and guns
So this is for them gangsters', rep where you're from
When I got older, my heart turned colder
That's why the Mac react like a King Cobra
Now I'm jumping out of Rovers in Gucci loafers
Y'all niggers want to stun, I'll bury you cockroaches
Give me one year, in this industry
I'll buy enough guns to declare war on a small country

[Chorus: 50 Cent]
You're thicker than water, ouch, twizzy wizzy wa
You're thicker than water, ouch, twizzy wizzy wa
You're thicker than water, ouch, twizzy wizzy wa
You can be a Blood or a Crip, nigga, bitch, follow me
You're thicker than water, ouch, twizzy wizzy wa
You're thicker than water, ouch, twizzy wizzy wa
You're thicker than water, ouch, twizzy wizzy wa
You can be a Blood or a Crip, nigga, bitch, follow me

[Verse 3: Lloyd Banks]
Still walk around with the hammer boss, rope, and a cross
Hard times will make a little nigga hate Santa Claus
Your mileage is high, older than Diana Ross
I'm like a two thousand and three banana Porsche
I don’t got to hire sluts, to get your tires cut
They on my dick because I make groupies set off a fire truck
My team in the cut, packing metal things
That's more foreign shooters than the Sacramento Kings
It's eight class karats in the border
I poke ho's in plastic to avoid a vaginal disorder
I'm a savage on your daughter, she ain't in the college dorm
Then I guess I'm squirting on the cabin that you bought her
I'm a heavy weed smoker so the average is a quarter
Brown coloured from shit he established in the water
You got Banks on your jersey, you're part of my fanbase
Just because you pour syrup on shit, don't make it pancakes

[Chorus: 50 Cent]
You're thicker than water, ouch, twizzy wizzy wa
You're thicker than water, ouch, twizzy wizzy wa
You're thicker than water, ouch, twizzy wizzy wa
You can be a Blood or a Crip, nigga, bitch, follow me
You're thicker than water, ouch, twizzy wizzy wa
You're thicker than water, ouch, twizzy wizzy wa
You're thicker than water, ouch, twizzy wizzy wa
You can be a Blood or a Crip, nigga, bitch, follow me",50 Cent,Follow Me Gangster,"Lloyd Banks, Tony Yayo"
