lyrics,artist,song_title,featuring
"[Intro: Damian Marley]
Two sides to a coin
And one must chose which side they join
You know?
Brotherman

Yeah
And meanwhile one man's meal
Is another man's poison
Mankind will do what they must to survive
Innit

Hear me now

[Verse 1: Damian Marley]
In a gunman world
Any night him clock in at work
Marrow splatter, the toolbox pull
The magazine inna the two Glock full
And he's watching as the days go by
And he's counting as his peers all die
Sleeping with the rifle 'cross his chest
So he never gets a good night's rest
And then he's cranky in the morning times
And more victims have to lose their lives
The community a twist and twirl
Wishing that they wasn't in a gunman world

In a gunman life
He might not come home from work one night
So every minute matter
Ignores advice
From his weeping baby mother and child
That he won't win every game he plays
So she know he'll meet his end one day
Some juvenile will have to earn his stripe
And have to take another gunman's life
What if a backstabber names his price
And how ironic if him dead from knife
The 'mount of bullet weh him put 'pon boy
Job description: kill and destroy

[Refrain: Damian Marley]
Now tell me is it worth it all?
If one don rise then a next must fall
Tell me is it worth it all?
Those sleepless nights on patrol roll call
Tell me is it worth it all?
One child smile while a next one bawl
Tell me is it worth it?
Is it worth it?
Is it worth it all?

[Verse 2: Damian Marley]
Well in a gunman world
Life is so stressful
Back to school time come
'cuz when a gunman work
If he is successful
And the job is well done
Then there will be an unsolved crime
With no one to fill out all blank line
John Public haffi hear and deaf
Informer get a kuff, kaff, kweff
Does he get nervous just like you and I?
Watching out if the police pass by
'cuz any day you hear a gunman fail
Then it's either dead house or jail
What will it cost to make a gunman rich?
How many lives before a gunman switch?
The truth me want the youth them stop ignore
Say the majority of gunman poor, oya oh

[Refrain: Damian Marley]
Now tell me is it worth it all?
If one don rise then a next one fall
Tell me is it worth it all?
Those sleepless nights on patrol roll call
Tell me is it worth it all?
One child smile while a next one bawl
Tell me is it worth it?
Is it worth it?
Is it worth it all?

[Verse 3: Damian Marley]
And when a gunman makes choice
I wonder what goes through a gunman's mind
And does a gunman think twice?
Before him takes another someone's life?
I wonder what it is a gunman say
To the Father when a gunman pray
Does he kiss his kids to bed at night?
Making sure the blanket tucked just right?
Nothing no scary like a gunman voice
When people beg a gunman think twice
And him say no

Wha coulda scary like a gunman voice
When people beg a gunman think twice
And him say no

[Refrain: Damian Marley]
Can you tell me is it worth it all?
If one don rise then a next must fall
Tell me is it worth it all?
Those sleepless nights on patrol roll call
Tell me is it worth it all?
One child smile while a next one bawl
Tell me is it worth it?
Is it worth it?
Is it worth it all?",Damian Marley,Gunman World,
"[Intro]
Okay, remember to breathe
And one and two and three and bounce and bounce
And bounce, bounce, bounce, bounce
Bounce, bounce, bounce
Bounce, bounce, bounce

[Pre-Chorus]
It's like keeping a stage show and want the place fi done
Wha you do, call my management that walk wid 50 gun
Wha mi do, nah goin' go pon stage until me get me funds
Wha mi sing, one Jr. Gong what a hefty sum
Youngest veteran intercept di run
Artist a carry feelings and tears a run
Say you know, say a just true, him a Bob Marley son
How him get a Swizz Beatz and you nuh get me none
Wha mi sing strictly ex amount of high grade sess mi bun
Wha mi sing strictly only high grade princess mi bun
Politician well love push up dem chest mi bun
Certain loud rowdy talking interest mi gun
Now mi come fi bun down all material object
Wid a raas claat gold chain 'round me neck
Me bun a fire pon di man weh love bitch and fret
And want every little detail intricate

[Chorus]
Well, dem just can't believe or dem won't accept
Jr. Gong and Swizz Beatz, fassy don't forget
Well, is it just me or is it hot to death
It's the Halfway Tree C.D. and cassette
D.J. race a run on your mark, get set
And watch everybody run to the record outlet
Tell me who C.D. do you think they get
The one closest to the Bob Marley box set

[Verse 1]
And boom and anyhow you nuh feel me yet
Well, chances are you might soon go def
Me have a clip fully loaded and one select
Fi any bwoy weh nuh want show the Gong respect
All me shirt and shoes and pants me bet
Say a nuff D.J. haffi go starve to death
While dem girl read about me on the Internet
But it's not their fault, don't get upset
Because dem can't touch me intellect
And boom dem can't even bounce a check
Well, you better rest your drinks pon a serviette
And gwon bounce around until you sweat

[Interlude]
Okay, remember to breathe
And one and two
Just bounce, bounce, bounce
Bounce
Just bounce, bounce, bounce
Bounce
Bounce, bounce, bounce
Bounce
Bounce, bounce, bounce

[Verse 2]
So return to di venues you used to fill
And return to the ends where you used to chill
I know them putting punks up on over kill
Wid some everyday tune, I refuse to build
Now you've been waiting patiently until boom
A me name Jr. Gong and still, boom
Ridin' a bounce and you can't stand still, boom
See it deh now your drinks a spill
You have some D.J. think dem shoot to kill
'Cause dem spar wid, a couple thug youths weh will
Wait till dem lickle chumpas, dem have draw nil
Ah di same thug, ah climb thru dem windowsill
And, anyhow you no pay di bill
Well, dem could a find you a Sligoville
You better mind how you use your talent and skill
Till you hear man a bruk down your burglar grill
Well, it's from baby pram n to Stroller dem
We rock mics anywhere, we get a hold a dem
Wid di Muffin looking over, we shoulder dem
Better read out all mi portfolio dem
Well, it's roots and branches, sticks and stems
A di Halfway Tree and it a murder dem
Ghetto youths, one fam, you never heard a dem
Dangerous nightlife observer dem

[Bridge]
So just bounce, bounce, bounce wit' me
Big man big woman and pickney
Feel no pain when di music hit me
Find all a gyal weh fit me

[Pre-Chorus]
Keeping a stage show and want the place fi done
Wha you do, call my management that walk wid 50 gun
Wha mi do, nah goin' go pon stage until me get me funds
Wha mi sing, one Jr. Gong what a hefty sum
Youngest veteran intercept di run
Artist a carry feelings and tears a run
Say you know, say a just true, him a Bob Marley son
How him get a Swizz Beats and you nuh get me none
Wha mi sing strictly ex amount of high grade sess mi bun
Wha mi sing strictly only high grade princess mi bun
Politician well love push up dem chest mi bun
Certain loud rowdy talking interest mi gun
Now mi come fi bun down all material object
Wid a raas claat gold chain 'round me neck
Me bun a fire pon di man weh love bitch and fret
And want every little detail intricate

[Chorus]
Well, dem just can't believe or dem won't accept
Jr. Gong and Swizz Beatz, fassy don't forget
Well, is it just me or is it hot to death
It's the Halfway Tree C.D. and cassette
D.J. race a run on your mark, get set
And watch everybody run to the record outlet
Tell me who C.D. do you think they get
The one closest to the Bob Marley box set

[Chorus]
Well, dem just can't believe or dem won't accept
Jr. Gong and Swizz Beatz, fassy don't forget
Well, is it just me or is it hot to death
It's the Halfway Tree C.D. and cassette
D.J. race a run on your mark, get set
And watch everybody run to the record outlet
Tell me who C.D. do you think they get
The one closest to the Bob Marley box set

[Outro]
So just
Bounce, bounce, bounce
Bounce, bounce, bounce
Bounce, bounce, bounce",Damian Marley,Halfway Tree,
"[Verse 1]
Here we go
My big ego is gonna get me in trouble
Trying to play hero
My jeans can't tight like Michael Phelps speedo
We no play follow fashion, when we lead out
Now looky here, my big ideas
Gonna get me in trouble now amongst my peers
But have no fear, no bother cry tears
You're just miles ahead when I'm ahead light years

[Chorus]
(Here.. here I come again)
Gong originally, run fi the grand finale
(Have no fear.. for it is only I)
I do it regularly, through every hill and valley
(I'm here to teach you only truth)
It's Mister Warm and Easy
Somebody please believe me
(For the things you do, Jah is watching you)

[Verse 2]
Man a wah do some likkle bomboclaated
Weh feel like them big 'cause dem album charted
Well all bad card will be disregarded
No punk cyaan finish weh what Bob Marley started
Gong to the Zilla, I'm the Don Die-Hearted
Anywhere me go, dem roll out red carpet
Some man a buy car and nah no house fi park it
Nah unify dem selfish like market
Dem sell out dem souls just to be rewarded
Bleach out dem skin, dem favour dead to rahtid
Soul too corrupt and dem blemish and faulted
Real Rastaman we cannot be outsmarted
Gong's not the one fi a bwoy take chance with
Ancient Nazarite weh make the Red Sea parted
Provide the harvest, in drought and shortage
With Jah by my side I've got all advantage

[Chorus]
(Here.. here I come again)
Gong originally, run fi the grand finale
(Have no fear.. for it is only I)
I do it regularly, through every hill and valley
(I'm here to teach you only truth)
It's Mister Warm and Easy
Somebody please believe me
(For the things you do, Jah is watching you)

[Verse 3]
So buy your tickets to the show, get there early grab a seat
The real Gong is in the house, everything else counterfeit
If I have not been around, it's a part of my mystique
I've been busy so to speak, I've been winning on a streak
I've been feeling like a Wednesday, surrounded by the week
Be strong alone continue, fi di justice where we seek
So doh follow some DJ cah dem swimming up a creek
Dem inna deeper shit when time dem an dem maker meet
And if you buy the bullshit, then don't lose your receipt
Them bound fi self destruct, mi ago lowe dem, mek you see it
Dem sow weh dem a reap, dem think say Jah no seet
When the stage show full a demon and the club dem full a freak
And the dancehall full a pagans and dance like dem a Greek
Dem renk and dem a reek, dem pop down one a week
Dem always overdweet, but turn the other cheek
The earth is for the meek, huh

[Chrous]
(Here.. here I come again)
Gong originally, run fi the grand finale
(Have no fear.. for it is only I)
I do it regularly, through every hill and valley
(I'm here to teach you only truth)
It's Mister Warm and Easy
Somebody please believe me
(For the things you do, Jah is watching you)

[Verse 4]
Me do a thousand video shooting, ten thousand chariot
Hundred thousand photo shoot and million radio drop
Mi deejay til' me hoarse a welcome people to the rock
You think a silver spoon or like it drop inna mi lap
Me sign a billion autograph, up to now the tour no stop
Trade privacy for privilege, it balance when it swap
Tony Rebel say a reggae put Jamaica 'pon the map
Who am I to disagree when I've been reaping up the crop
My first release was '93, when dem a feed pon Similac
First Grammy at 23, tell me which one a dem do that
Another tour at 27, add it up and do the maths
The weight weh dem a carry that no heavy like me locks
I'm a veteran, the youngest to be exact
Ghetto people love me bad, I'm guessing opposites attract
Uptown me born and grow, Stony Hill to mark the spot
Big Gong to the Zilla and the return of the mac",Damian Marley,Here We Go,
"[Chorus: Stephen Marley & Rovleta Fraser]
Hey Girl
The way you make me feel
I know your love is real
You satisfy my every want and need
Hey Boy
You're always on my mind
We need to spend more time
Cause no one else can touch my heart inside

[Verse 1: Damian Marley]
She look so good in her clothes, she get dressed and roll
So much man a flay down, call the pest control
Confident princess, she address them bold
She nah manifest, fi dem sexual goal
She wish them the best, rasta bless them soul
Her mouth nah filthy, like nuh cess tank pool
Smarter than most intellectual fools
Weh spend dem time pon internet chat rooms

[Pre-Chorus: Damian Marley]
She said Jr. you're a genius
You think with your mind and not your peanuts
Your gang of Jamaican Al Pacinos
Drinking blue mountain cappuccinos
Well I seh baby you the cleanest
The true definition of what my queen is
Nothing coulda ever really come between us
Share the same room and Jah will feed us

[Chorus: Stephen Marley & Rovleta Fraser]
Hey Girl
The way you make me feel
I know your love is real
You satisfy my every want and need
Hey Boy
You're always on my mind
We need to spend more time
Cause no one else can touch my heart inside

[Verse 2: Damian Marley]
Why mi love fi all she's worth
Sitn' fi gwan she wi start it first
Wheel and pop off, supn' outta she purse
Whole heap a fool have to start disperse
Police ah come you see how fast she splurt
Can't find no sign of she khaki skirt
Light up the place like we spark there herbs
Love watch the way that she gwan
When a big tune a play pon the dance-hall set
Selector rewind every chance dem get
The rhythm design fi she dance and sweat
All when morning a shine she nuh start dance yet
Man clear the line when she walk and sweat
But she nah pay no mind to remarks dem mek
Always on time tek a chance and bet
She's a fine piece of mind with the right mindset

[Pre-Chorus: Damian Marley]
She said Jr. you're a genius
You think with your mind and not your peanuts
Your gang of Jamaican Al Pacinos
Drinking blue mountain cappuccinos
Well I seh baby you the cleanest
The true definition of what my queen is
Nothing coulda ever really come between us
Share the same room and Jah will feed us

[Chorus: Stephen Marley & Rovleta Fraser]
Hey Girl
The way you make me feel
I know your love is real
You satisfy my every want and need
Hey Boy
You're always on my mind
We need to spend more time
Cause no one else can touch my heart inside

[Verse 3: Damian Marley]
So Boom!
Animal you never know from you born place
You only see when travel channel tun on
Our means of trans-p is when the camel run on
Camouflage and fatigue is our style and fashion
""Fliminitti"" weh she have and that is the attraction
What she want is what she get and that is satisfaction
Well she want it all night and not jus fi a fraction
Well too much long talking now a time fi action
Well she love fi spend money but she rather spend time
And if mi gone fi ten minutes, then she call me ten time
If mi nuh pick up then she panic then she panic then she call mi friend line
Cause she want the veteran fi come and bend up her spine
A substantial amount of african fly squat
I have to sip a roots and bun a one night cap
And she love the veteran him always hit the right spot
And the way she feel so good I have to bounce right back

[Chorus: Stephen Marley & Rovleta Fraser]
Hey Girl
The way you make me feel
I know your love is real
You satisfy my every want and need
Hey Boy
You're always on my mind
We need to spend more time
Cause no one else can touch my heart inside",Damian Marley,Hey Girl,"Rovleta Fraser, Stephen Marley"
"Want to commit suicide
Cause you've been denied your 9 to 5
You're in 2 deep
If you're over 10
And watch CNN and believe everything
You're in 2 deep
And your 35
And you still survive, idle pon corner side
You're in 2 deep
And your 55
And don't have a child, for your joy & your pride
You're in 2 deep
And yuh riding a freak
And she love how you do it, and your condom deplete
You're in 2 deep
And she seh, ""Baby please.""
And you're weak in the knees and kick off and release
You're in 2 deep
Then you hear from the streets
Seh she full of disease, and you start to sneeze
You're in 2 deep
All months and fi weeks
All food yuh nuh eat, and you weight start decrease
Youre in 2 deep

[Hook]
So don't be in 2 deep
For you wi' incomplete
When you drop in the streets
You wi' drop in 2 deep

And don't be in 2 deep
For you wi' incomplete
When you drop in the streets
You wi' drop in 2 deep

[Verse 2]
You a war 'gainst the Beast
And when things fi squeeze, that's when you-a freeze
You're in 2 deep
And you one a bleach
And you drop asleep, and machine a beat
You're in 2 deep
You exault and hype
Like you fling Dandimite, and nuh live gangster life
You're in 2 deep
And a run off you beak
And your thing go breach, and Bad Man go see it
You're in 2 deep
Then if a one police
Find you with yuh piece, and you start to squeal
You're in 2 deep
And you get release
Man a circle you neat, and you think it nuh real
You're in 2 deep
Then true things go steep
You go decide fi sneak some coke in your crease
It's in 2 deep
And go overseas
And same time you reach, dog sniff out you crease
He's in 2 deep

[Hook Repeats]
So don't be in 2 deep
For you wi' incomplete
When you drop in the streets
You wi' drop in 2 deep
And don't be in 2 deep
For you wi' incomplete
When you drop in the streets
You wi' drop in 2 deep

[Verse 3]
You a brag 'bout your wealth
And speak of yourself, like you're someone else
You're in 2 deep
When you just start to grow
But you think you a pro cause you see it inna show
You're in 2 deep
Thin you know everything
And worship the bling and deny the King
You're in 2 deep
Mesmerized by the beat
CD on repeat memorizing my speech
You're in 2 deep

So don't be in 2 deep
For you wi' incomplete
When you drop in the streets
You wi' drop in 2 deep
And don't be in 2 deep
Your papa incomplete
When you drop in the streets
You wi' drop in 2 deep

Want to commit suicide
Cause you've been denied your 9 to 5
You're in 2 deep
If you're over 10
And watch CNN and believe everything
You're in 2 deep
And your 35
And you still survive, idle pon corner side
You're in 2 deep
And your 55
And don't have a child, for your joy & your pride
You're in 2 deep
And yuh riding a freak
And she love how you do it, and your condom deplete
You're in 2 deep
And she seh, ""Baby please.""
And you're weak in the knees and kick off and release
You're in 2 deep
Then you hear from the streets
Seh she full of disease, and you start to sneeze
You're in 2 deep
All months and fi weeks
All food yuh nuh eat, and you weight start decrease
You're in 2 deep

So don't be in 2 deep
For you wi' incomplete
When you drop in the streets
You wi' drop in 2 deep
And don't be in 2 deep
For you wi' incomplete
When you drop in the streets
You wi' drop in 2 deep

You a war 'gainst the Beast
And when things fi squeeze, that's when you-a freeze
You're in 2 deep
And you one a bleach
And you drop asleep, and machine a beat
You're in 2 deep
You exault and hype
Like you fling Dandimite, and nuh live gangster life
You're in 2 deep
And a run off you beak
And your thing go breach, and Bad Man go see it
You're in 2 deep
Then if a one police
Find you with yuh piece, and you start to squeal
You're in 2 deep
And you get release
Man a circle you neat, and you think it nuh real
You're in 2 deep
Then true things go steep
You go decide fi sneak some coke in your crease
It's in 2 deep
And go overseas
And same time you reach, dog sniff out you crease
He's in 2 deep

So don't be in 2 deep
For you wi' incomplete
When you drop in the streets
You wi' drop in 2 deep
And don't be in 2 deep
For you wi' incomplete
When you drop in the streets
You wi' drop in 2 deep

In 2 deep
Incomplete
In the streets
In 2 deep
In 2 deep
Incomplete
In the streets
In 2 deep",Damian Marley,In 2 Deep,
"[Chorus: Stephen Marley]
And it was written
Up in the book of life
That a man shall
Endure forever more
And it was written
Up in the book of life
That a man shall
Endure forever more

[Verse 1: Damian Marley]
Well did you know the pen
Is stronger than the knife
And they can kill you once
But they can't kill you twice
Did you know destruction of the flesh
Is not the ending to life
Fear not of the anti-christ
Did you know that I
Exist before the earth
And did you know my eyes
Are windows to the world
Did you know you can't go to Zion and wear jheri curls
Can't tell the boys from the girls
Your body’s just a vehicle
Transporting yo' soul
It's what’s inside ah people
Is beauty to behold
Fear not of evil
Everyday dem flesh it grow old
Changes of the times take the toll

[Chorus: Stephen Marley]
And it was written
Up in the book of life
That a man shall
Endure forever more
And it was written
Up in the book of life
That a man shall
Endure forever more

[Verse 2: Capleton]
The one ya name, fear is in the eyes of the beholder
And love is in the presence of the love maker
Life is in the words of the comforter
Endure much longer, live much longer
Fear is in the eyes of the beholder
And love is in the presence of the love maker
Life is in the words of the comforter
Endure much longer, live much longer

[Verse 3: Damian Marley]
A vest around his chest and Rastafari is his name
The gift of everlasting life for us to all sustain
Blessing that you all begot
Lessons that you all forgot
Rasta call it shit you not
Do you remember Elijah
And his chariot of flames
Same blood that runs thru my veins

[Verse 4: Capleton]
The one ya name, fear is in the eyes of the beholder
And love is in the presence of the love maker
Life is in the words of the comforter
Endure much longer, live much longer
Fear is in the eyes of di beholder
And love is in the presence of the love maker
Life is in the words of the comforter
Endure much longer, live much longer
Careful how you entertain stranger
Selassie never born inna nuh manger
And I'm never crucify as nuh savior
Elect off himself inna the ruler
Babylon ah nah malfunction well dem a failure
So be careful of dem cellular and pager
Cause I sign see dem I see danger
So dem great but Selaisse I greater

[Chorus: Stephen Marley]
That a man shall
Endure forever more
And it was written
Up in the book of life
That a man shall
Endure forever more

[Verse 5: Drag-on]
Me think me wanna lick upon shots
Upon a bloodclot
And fill the block with bumbaraas cops
Cops mi dun talk you know you watch me walks in
While black woman is getting raped across New Yorks And
Before another brother's in chalks And
I imagine somebody said that's your son dead, see him?
See us we do the crime we do the time
Y'all get away scott-free
So police mi gonna pop you before you pop me
Cause if you get me you got me you shot me
Know'll lot me carry shotty since moms slap me
Cause my room sloppy
The youngest nigga out the camp is me
But nobody pampered me
So you better don't ramp with me
Fi see me, me don't play plenty
Chicks me blazed many
Raised plenty fi dollars
Storm upon mi prada
Watch a bomb holla
Watch 'im run, hit the floor
Told I'm come, come no
Throw ya ganja pon de air
'plah!'

[Chorus: Stephen Marley]
And it was written
Up in the book of life
That a man shall
Endure forever more

[Verse 6: Damian Marley]
So watch for sticks and stones, stumbling blocks in piles
Life is one big road, miles on top of miles
So blessed be the soul that always remains a child
When most people don't even smile
There's a natural mystic, blowing tru the air
So keep it realistic, and always be aware
The truth is crying out, and it's so loud and so clear
But most people won't even hear
Spiritual pollution in the atmosphere
And with so much confusion, can one be happy here
The gift of Rastafari is for all man to share
But some would rather to be so unfair

[Chorus: Stephen Marley]
And it was written
Up in the book of life
That a man shall
Endure forever more
And it was written
Up in the book of life
That a man shall
Endure forever more
And it was written
Up in the book of life
That a man shall
Endure forever more",Damian Marley,It Was Written,"Stephen Marley, Drag-On, Capleton"
