lyrics,artist,song_title,featuring
"[Verse 1: Stephen Marley]
Turn 'em up
Get them ready
King sincerely
Get them ready now, ready now
She's a pretty little thing

[Chorus: Stephen Marley]
It's time for us to get closer now
Wanna feel your touch
Wanna hear your sound
Every time I see, see your face
You paint the perfect picture
Every time I'm with ya
Oh you and I, a world apart
Please let me know, if I have your heart
Cause every time I'm with ya
You paint the perfect picture

[Verse 2: Damian Marley]
This relationship, society can't relate
They say we're two opposite
They say it's all a mistake
They say I'm no good for you
They say you're too good for me
Dem seh the puzzle nuh fit
Well baby I disagree
Your mama told you to be
A very good behaving
And now just because of me
They say you're misbehaving
Dad is not talking to you
Because he doesn't approve

[Chorus 2: Stephen Marley]
My lies no truth, my truth no lie
Oh Jah is here, so I must obey
Oh you and I, a world apart
But every time I'm with ya
We paint the perfect picture
Please let me know, if I have your heart
We'll share the pains, oh we'll share the joy
Cause every time I'm with ya
We paint the perfect picture

[Verse 3: Damian Marley]
She said they taught her to love
And now they want her to hate
They say they're kicking her out
She told them she'll be okay
As long as she's loving me
She told them she'll be alright
She's so ready to live
She's excited for life
Is she reckless at heart
Cause she won't leave me alone
She's always in my thoughts
I got her face on my phone
Picture's as perfect can be
Every time she's with me

[Chorus: Stephen Marley]
It's time for us, to get closer now
I'm gonna feel your touch
I'm gonna hear your sound
Every time I see, see your face
You paint the perfect picture
Every time I'm with ya
Oh you and I, a world apart
Please let me know, if I have your heart
You paint the perfect picture
Every time I'm with ya

[Verse 4: Damian Marley]
Well baby it's you and me
We're painting portraits of love
Why won't they let us be free
And just let God be the judge
They've never been so ashamed
We've never been so in love
I'd rather hold on to you
They'd rather hold on to grudge
It's always been me and them
It's always been you and I
They taught us live and let live
They'd rather live and let die
I pray they live to forgive
And I say baby don't cry.......
Cause when it's all said and done
And man a shed flesh and bone
They won't care who was wrong
They would wish you were home
It's reminding me of a little story I know
It's like Lee and Molly
Or maybe Leah alone

[Outro]
Mona Lisa, Mona Lisa, I adore you...
You're pretty like a picture with love
You're my Mona Lisa
Mona Lisa, Mona Lisa, I adore you...
You always paint the perfect picture with love
You're my Mona Lisa
Mona Lisa, Mona Lisa, I adore you...
You always paint the perfect picture with love
You're my Mona Lisa... you're my Mona Lisa...
You're my Mona Lisa.......picture with love
You're my Mona Lisa
Mona Lisa, Mona Lisa, I adore you...
You paint the perfect picture with love
You're my Mona Lisa
Mona Lisa, Mona Lisa, I adore you...
You paint a perfect picture with love...",Damian Marley,Perfect Picture,Stephen Marley
"[Intro: Black Thought]
And yes y'all, you now rockin with the best
Black Thought from the legendary Roots crew in the flesh
I slid up in here with the brothers from the Marley family, crestin, we 'gon set for y'all

[Verse 1: Stephen Marley]
Hey! She loves to party, have a good time
She looks so hearty, feeling fine
She loves to smoke, sometimes shifting coke
She's laughing when there ain't no joke, hey!!!

[Hook: Stephen Marley] (Background Singers)
(Pimpa's paradise) That's all she was now
(Pimpa's paradise) That's all she was
(Pimpa's paradise) That's all she was, now
(Pimpa's paradise) That's all she was

[Verse 2: Damian ""Jr. Gong"" Marley]
Cause coke was a thing that once she first tried
Was once a blue moon to once a blue sky
And now she's wonderin who else wants to go buy
She don't got no money and wants to get high
Story sounds familiar like born to be wild
But she sillier, not quite the same but she similiar
A waste of a sarsaparilla
Used to look good in the videos now she look hideous
Now it's broken crack pipes with lipstick traces
Work the cold nights red district places
She seen more hotels then my tour suitcases
More male customers than Old Navy
She love limelight more than John Swayze
Seen more miles than a rental, Avis
She don't slow down then some day maybe
She lost then she can't find her way to safety

[Hook: Stephen Marley] (Background Singers)
(Pimpa'ss paradise) That's all she was now
(Pimpa's paradise) That's all she was
(Pimpa's paradise) That's all she was, now
(Pimpa's paradise) That's all she was

[Verse 3: Black Thought]
Check it out! She keep her head up in space like a satellite
Because she got a insatiable appetite
For stayin out late night with all the parasites
Plottin on the way to cop a little piece of paradise
Her dignity the only thing that she could sacrifice
Just get the monkey off her back and she be back in like
Five minutes, she stay on the move
She done smoked up the stone that the builder refused
All coked up, alone she ain't even in tuned
And it's sad cause she ain't really have a reason to use
She was a pretty girl cleaner than the board of health, studied and enjoyed herself
I don't know what drove her to avoid herself
Destroyed herself and took a taste of the yay
And now she on the track workin while she wastin away
It's safe to say she lookin for some place to stay
Whoever got a lil' paper to play could get a slice of this..

[Hook: Stephen Marley] (Background Singers)
(Pimpa's paradise) That's all she was now
(Pimpa's paradise) That's all she was
(Pimpa's paradise) That's all she was, now
(Pimpa's paradise) That's all she was

[Verse 3: Damian ""Jr. Gong"" Marley]
For no reason a seasoned spliff was the first thing
One spring season while she's out flirtin
Now she season me and don't need rehearsin
Esteem get a beatin', life is uncertain
Ego need feedin now no one's mercy
Beneath the demons she's a warm person
When she's not fiendin swearin and cursin
Behind the curtain she's really hurtin
And while her people don't even trust her at home
The dealer that bring and cook the rock down
And she without sinnin will spot the first stone
The feelin kicks in she's in the dark zone
Old friends walk pass goin bout there own
As if she is someone that they don't know
Then the King Of Kings lift her off the flo'
Sayin life is a thing when you learn you grow

[Hook: Stephen Marley] (Background Singers)
(Pimpa's paradise) That's all she was now
(Pimpa's paradise) That's all she was
(Pimpa's paradise) That's all she was, now
(Pimpa's paradise) That's all she was

[Outro: Damian ""Jr. Gong"" Marley & Stephen Marley]
She rise and fall like a star, her life write off like a car
Her face full of all kind of scar, always quick fi start a war
She can't keep herself up to par, she plays like a broken guitar
She always want take it to far
I doubt she ah go make it too far
She rise and fall like a star, her ride off like a car
Her face full of all kind of scar, always with fist start a war
She can't keep herself up to par, she plays like a broken guitar
She always want take it to far
Mi wonder if she make it so far, wuy!!!!",Damian Marley,Pimpa’s Paradise,"Stephen Marley, Black Thought"
"[Intro: Damian Marley]
Yeah man
Jah will be waitin there we a shout
Jah will be waitin there

[Pre-Chorus: Damian Marley]
In this world of calamity
Dirty looks and grudges and jealousy
And police weh abuse dem authority
Media clowns we nuh know bout variety, boom

[Verse 1: Damian Marley]
Di youngest veteran a come murder dem slow
Raggamuffin sent to call me from di bush bungalow
Mi nuh watch it mek I clear out my voice now, Figaro
Emerge from the darkness with mi big blunt a glow
Di hammer dem a slam and spectator getta low
Some bwoy could a big like Bam Bam Bigelow
Buss off trigger finger, trigger hand and trigger toe
A two gun mi have mi buss dem inna stereo, 'cause

[Chorus: Damian Marley]
I got to keep on walkin', on the road to Zion, man
Hey, we got to keep it burnin', on the road to Zion, man

[Bridge: Damian Marley]
Clean and pure meditation without a doubt
Don't mek dem take you like who dem took out
Jah will be waitin there we a shout
Jah will be waitin there

[Pre-Chorus: Damian Marley]
In this world of calamity
Dirty looks and grudges and jealousy
And police weh abuse dem authority
Media clowns we nuh know bout variety
Single parents weh need some charity
Yutes weh need some love and prosperity
Instead of broken dreams and tragedy
By any plan with any means and strategy, say

[Chorus: Damian Marley & Nas]
We got to keep on walkin', yeah
On the road to Zion, man, yeah
Been waitin' to do this track with you man
Yeah, ha ha, yeah yeah
You know, they know
You got to keep on walkin', yeah
On the road to Zion, man
You gotta keep walkin' y'all, yeah, yeah, you gotta keep

[Verse 2: Nas]
Sometimes I can't help but feel helpless
I'm havin daymares in daytime wide awake try to relate
This can't be happenin like I'm in a dream while I'm walkin
Cause what I'm seein is hauntin, human beings like ghost and zombies
President Mugabe holdin guns to innocent bodies
In Zimbabwe, they make John Pope seem Godly, sacrilegious and blasphemous
In my lifetime I look back in paths I walked, where savages fought and pastors taught
Prostitutes stomp in high heel boots
And badges screamin' at young black children: ""Stop or I will shoot""
I look back at cooked crack plus cars that pass by
Jaguars mad fly, and I'm guilty for materialism
Blacks is still up in the prison trust that
So save me your sorries, I'm raisin' an army
Revolutionary warfare with Damian Marley
We sparkin' the ions, marchin' to Zion
You know how Nas be NYC state of mind I'm in

[Pre-Chorus: Damian Marley]
In this world of calamity
Dirty looks and grudges and jealousy
And police weh abuse dem authority
Media clowns we nuh know bout variety, boom

[Verse 3: Damian ""Jr. Gong"" Marley]
Di youngest veteran a come murder dem slow
Ragamuffin sent to God before di bush bungalow
Mi nuh watch it mek I carry out my voice now figarow
Emerge from the darkness with mi big blunt a glow
Di hammer dem a slam and spend day a dead now
Some bwoy could a big like Bam Bam Bigelow
Buss off trigger finger, trigger hand and trigger toe
A two gun mi have mi buss dem inna stereo, 'cause

[Chorus: Damian Marley]
I got to keep on walkin', on the road to Zion, man
Hey, we got to keep it burnin', on the road to Zion, man

[Bridge: Damian Marley]
Clean and pure meditation without a doubt
Don't mek dem tek yuh like who dem took out
Jah will be waitin there we a shout
Jah will be waitin there!
Clean and pure meditation without a doubt
Don't mek dem tek yuh like food dem to goat
Jah will be waitin there we a shout
Jah will be waitin there!

[Pre-Chorus: Damian Marley]
In this world of calamity
Dirty looks and grudges and jealousy
And police weh abuse dem authority
Media clowns we nuh know 'bout variety
Single parents weh need some charity
Yutes weh need some love and prosperity
Instead of broken dreams and tragedy
By any plan with any means and strategy
Instead a broken dreams and tragedy
Yutes weh need some love and prosperity
Instead a broken dreams and tragedy
By any plan with any means and any strategy

[Chorus: Damian Marley]
Hey say
I got to keep on walkin', on the road to Zion, man
You know
You got to keep on walkin', on the road to Zion, man",Damian Marley,Road to Zion,Nas
"[Verse 1]
Big up di lion dem weh roar fi a cause
Defend you community at all costs
Never yet run, stand your ground till di last
Real outlaw people love we because
Nuh old woman purse can get grab off
Nuh juvenile pon di road after dark
Nuh visitors can get rob inna di park
Else bwoy will finish before dem start
No shotta can give nuh juvenile gun
No stinginess, when di site money run
No likkle shop can get bruk inna di slum
All who perpetrate haffi pack up and run
No man to more dan dem share of kegs
One voice a talk just like Simon says
No man no tief wen di ackee tree bear
It mek war bruk out and it happen each year
No man nuh frowns wen a man a mek food
Kings outta road, yuh see dem a get rude
Nuh shot nuh buss wen a man keep treat
Nuh man nuh disturb di children peace
Nuh car nuh bruk wen yuh hear dance a keep
Di last man weh try, bun up like rizzla sheet
Dem hear seh me soon come, tell dem me reach
Nuh man nuh talk wen di general speak

[Chorus]
Me say a me and unnu
Me and unnu
Me and unnu
Me and unnu bongo cart
Me say a me and unnu
Me and unnu
Me and unnu
Me and unnu bongo cart

[Verse 2]
Dem go rob di chiney man and dat a disrespect
And dem a gwaan like dem a don and nuh money nah mek
And dem a gwaan like dem a captain and di damn ship wreck
Soon enough a dem a suffer from twist neck
Tek it mek example, suh di ting set
All violators know what come next
Misbehaving, troublemaking, yow we won't accept
Certain bwoy fi disappear under magic carpet
All nuisance get weh dem fi get
People live peaceful, no need to fret
Cause, a we a guard dem outta street
Late a night wen dem a sleep
Kids in bed and counting sheep
And when dem wake up inna di morning and they'll be living sweet
Enterprise operation wrap up well neat
Back to business, everyting on beat
No man to more dan dem share of greens
No man nuh frowns when no fish nah steam
No man nuh frowns when di pot wah clean
No man nuh drink out di don spurline
No man nuh go round weh di big man said
No man nuh greedy and nah bruk bread
No man nuh go round di royal laws
All disloyal get nail pon cross

[Chorus]

Me say a me and unnu
Me and unnu
Me and unnu
Me and unnu bongo cart
Me say a me and unnu
Me and unnu
Me and unnu
Me and unnu bongo cart

[Outro]
A we a guard dem outta street
Late a night wen dem a sleep
A we a guard dem outta street
Late a night wen dem a sleep
A we a guard dem outta street
Late a night wen dem a sleep
A we a guard dem outta street
Late a night wen dem a sleep",Damian Marley,R.O.A.R.,
"[Hook]
You never hear a weh the Jr. say
See many girls who look so fine, and still
I'm searching even night and day
An can't find a gal who look so lovely
You never hear wey the muffin' say
Trod through the valley of the sweat and tears, and still
He's searching even night and day
Can't find a gal who look so lovely

[Verse 1]
You set the standard for all prestige
You're beauty plentiful just like plenty sand on the beach
You should a keep in a showcase when guarded by police
Me tek ten thousand chariots just fi reach
Well, mi see she blush then she bawl good grief
Gwan Jr. Gong you is living masterpiece
Well, a so me know she weak under mi speech
Mi big up Ragamuffin cause me learn as you teach
A the muffin show I and I how fi dress so neat
The proper way to behave anytime parents a meet
The courteous smile the only way to greet
Bon jour madam would you please have a seat
A cool beverage or maybe something to eat
I said a lady like yourself should not be seen on the street
Good thing mi no diabetic cause the way you so sweet
Nuff tender touches to sweep the girl off she feet
She said my aspect of life is genuinely unique
She need a real Ragamuffin to compliment her physique
And sing

[Hook]

Woman I would like to let you know just how this man feel
And express myself so the secret reveal
Gal me love you like how Georgie love cornmeal
I would like the privilege for me and you just fi deal
Well, full dedication I'm taking for real
You and me was meant to be just like a pedal and wheel
You a the treasure everyman want to steal
Excellent qualities with cross over appeal
Take you on a trip through the West Indies
Or maybe me and you can spend some time overseas
Well, smile fi awhile then she bawl yes please
Gwan Jr. Gong go show your expertise
Well, right then and there mi observe wey mi need
She's sweet than the honey that we get from the bees
Right at my finger tips is to touch and to tease
Cause mi de in a di program from mi eye deh a mi knees
Ital stew under nuff gungu peas
She want a real Ragamuffin to hug
And to squeeze

[Hook]X2

[Verse 1 repeated]
You set the standard for all prestige
You're beauty plentiful just like plenty sand on the beach
You should a keep in a showcase when guarded by police
Me tek ten thousand chariots just fi reach
Well, mi see she blush then she bawl good grief
Gwan Jr. Gong you is living masterpiece
Well, a so me know she weak under mi speech
Mi big up Ragamuffin cause me learn as you teach
A the muffin show I and I how fi dress so neat
The proper way to behave anytime parents a meet
The courteous smile the only way to greet
Bon jour madam would you please have a seat
A cool beverage or maybe something to eat
I said a lady like yourself should not be seen on the street
Good thing mi no diabetic cause the way you so sweet
Nuff tender touches to sweep the girl off she feet
She said my aspect of life is genuinely unique
She need a real Ragamuffin to compliment
Her physique

[Hook]",Damian Marley,Searching (So Much Bubble),
"[Intro]
I Jr.Gong long side Yami Bolo
Come to tell you a little story about the girl next door
Certain tings can happen but she will never know
Unless she come ah di Rasta man stage show
I Jr.Gong man have the love connection
Come fi sail like a big boat across the ocean
So come and get yourself inna di love motion
You have di Rastaman wid di love potion

[Chorus: Yami Bolo]
She needs my love
She said she needs my love
She need my love
She said she need Jah love
She needs my love
She said she needs my love
She need my love
She said she need Jah love

[Verse 1: Yami Bolo]
She is a girlfriend
She live next door
I think I've seen her
That face before
Her memories can't
Erase from my mind
I love ya angel
One of a kind

[Chorus: Yami Bolo]
She needs my love
She said she needs my love
She need my love
She said she need Jah love
She needs my love
She said she needs my love
She need my love
She said she need Jah love

[Verse 2: Damian Marley]
Well den she see me and she ball out
YO !! Jr.Gong
Di searching shall end
Where the searching begun
She need a bed room bully
Who's a real rangatan
She love me like how black yankee
Love Farrakhan
Well she's very impressed
With the youngest veteran
She started realizing
There's no better man
Now when time rain a fall
I become di weather man
Performing every one of
Her stage show dem fi long
I beg ya pardon deh
Miss kinky walking
Bright like sunlight
When me glimpse you dis morning
Come down to night
You ah mi moon shine darling
Mash up mi head
All when ah you mi eye balling
Ready fi di hundred
With out no stalling
Ince comes the youngest
Signal and warning
Big trampoline
For di bedroom brawling
Cause she's not just
Good she's appalling
Her performances
Deserve applauding

[Chorus: Yami Bolo]
She needs my love
She said she needs my love
She need my love
She said she need Jah love
She needs my love
She said she needs my love
She need my love
She said she need Jah love

[Verse 3: Damian Marley]
Precious trinket
[?]
Tell her fi link it
Me nah sink it
To piece and bit
When it come down to loving
It's a perfect fit
Whole heap ah more loving
And we just nah quit
She can't tek the vibe
Of Babylon dem spirit
Straight up loving
And ah nah no bull
Ah Rastafari bless her
With di ting she have
She have all right reserve
Fi she galang bad
Fresher than a vegetable
Inna mi market bag
Any time she come link up me ends
Me glad
Well ah she a get di money
And a spend di wad
Cuase me know the chumpas
Will not be squandered
She mek me start sing
Some Ray Charles ballad
Cause the style of the loving
Is not just a fad

[Bridge: Yami Bolo]
She need a lover
To hug and squeeze her tight
She need a man to
Come home at night
But he's always working
That's what she say
I had to tell her
Go home and pray

[Chorus: Yami Bolo]
She needs my love
She said she needs my love
She need my love
She said she need Jah love
She needs my love
She said she needs my love
She need my love
She said she need Jah love

[Verse 1 Repeat: Damian Marley]
Well den she see me and she ball out
YO !! Jr.Gong
Di searching shall end
Where the searching begun
She need a bed room bully
Who's a real rangatan
She love me like how black yankee
Love Farrakhan
Well she's very impressed
With the youngest veteran
She started realizing
There's no better man
Now when time rain a fall
I become di weather man
Performing every one of
Her stage show dem fi long
I beg ya pardon deh
Miss kinky walking
Bright like sunlight
When me glimpse you dis morning",Damian Marley,She Needs My Love,"Sabor, Yami Bolo"
"[Intro]
I can remember when huh those slavery times...

[Chorus: Damian Marley]
What you won't and what you will
Working for your dollar bill
Sad to see the old slave mill
Is grinding slow, but grinding still
Walking home, a youth gets killed
Police free to shoot at will
Sad to see the old slave mill
Is grinding slow, but grinding still
Nine to five you know the drill
Weekends are a short lived thrill
Sad to see the old slave mill
Is grinding slow, but grinding still
Cup runneth over till it spill
Take until they've had their fill
Sad to see the old slave mill
Is grinding slow, but grinding still

[Verse 1: Damian Marley]
Some of us think we're too big
'Cause the system gives us jobs
Even though it's just a low paying gig
Some of us will boast and brag
And those of us who think we're small
Just because we don't have much
That's really not the case at all
There's riches that the flesh can't touch
Some of us won't respect names
Some of us won't respect loves
Some of us don't respect life
Even though we worship God
And some of us won't let go faith
No matter what the price may cost
Some of us won't practice hate
Because we still believe in love

[Chorus: Damian Marley]
What you won't and what you will
Working for a dollar bill
Sad to see the old slave mill
Is grinding slow, but grinding still
Walking home, a child gets killed
Neighbors free to shoot at will
Hurt' to see the old slave mill
Is grinding slow, but grinding still
Nine to five, we know the drill
Weekends are such a short-lived thrill
Sad to see the old slave mill
Is grinding slow, but grinding still
Cup runneth over till it spill
Take until they've had their fill
Sad to see the old slave mill
Is grinding slow, but grinding still

[Verse 2: Damian Marley]
Most of us think we're too good
Just because material gain
If we were living as we should
Then less of us would be in pain
Those who are misunderstood
Still deserve a voice to claim
The things that are still meaningful
To each and all of us the same
And some will say the cups are full
And give Jah thanks to what we've gained
And some will say there's much more weight to pull
And them will tell you that straight up and plain
And some will think outside the box
While some of us will hold our lanes
And some of us we write the facts
While some of us a chop down cane

[Chorus: Damian Marley]
What men won't and what they will
Working for a dollar bill
Sad to see the old slave mill
Is grinding slow, but grinding still
Walking home, a child gets killed
Police free to shoot at will
Hurts to see the old slave mill
Is grinding slow, but grinding still
Nine to five you know the drill
Weekends are a short-lived thrill
Sad' to see the old slave mill
Is grinding slow but grinding still
Cup runneth over till it spill
Take until they've had their fill
Sad to see the old slave mill
Is grinding slow, but grinding still

[Outro]
Is grinding slow, but grinding still
Is grinding slow, but grinding still
Is grinding slow, but grinding still
Is grinding slow, but grinding still
Is grinding slow, but grinding still
Is grinding slow, but grinding still
Is grinding slow, but grinding still
Those slavery times... I can remember when huh...",Damian Marley,Slave Mill,
"[Verse 1]
Dread shine your light
So a child may follow
Many have been lost along the way
Until tonight
Turns into tomorrow
Teach them to be careful while at play
There’s nothing wrong with having fun
Don’t let the system tame you
It’s just a part of being young
And even though they’re quick to blame you
Picking on you like a plum
Because your dream became true
Now look what they’ve become
In open sight and plain view
They’ve already had a run
So meanwhile they try to change you
It’s not over till it’s done
So please remain the same you

[Chorus] x2
Hey young world (hey young world)
Hey young world (hey young world)
Hey young world
The world is yours

[Verse 2]
Dread shine your light
So a child may follow
Many have been lost along the way
Until tonight
Turns into tomorrow
Teach them to be careful while at play
You might not think you know enough
Don’t let that deter you
It’s all apart of growing up
And we’re all young enough to learn to
And don’t you live life in a rush
The past cannot be returned to
And when you feel like giving up
Remember patience is a virtue
When you fall try to get up
Have some guts, I’m trying to urge you
Be proud of owning up
The truth will never hurt you

[Chorus] x2
Hey young world (hey young world)
Hey young world (hey young world)
Hey young world
The world is yours

[Verse 3]
Dread shine your light
So a child may follow
'Cause many have been lost along the way
Until tonight
Turns into tomorrow
Teach them to be careful while at play
So when you’re rising start, be wise and smart
Try make your mark
Don't you hype and floss, and drive to fast
'Cause life’s too short
Try make good times last 'cause time fly past
And if time is money, that means time cost
But it don’t cost money to joke and laugh
So if you love somebody hurry up and talk

[Chorus]
Hey young world (hey young world)
Hey young world (hey young world)
Hey young world
The world is yours",Damian Marley,So a Child May Follow,
