lyrics,artist,song_title,featuring
"[Produced by Kanye West & The Neptunes]

[Intro: Kanye West]
Turn my headphones up, louder, uh-huh, uh-huh

[Sample: James Brown]
What you need, what–what you need
I got what you need, what–what you need (Bam)
What you need, what–what you need
I got what you need

[Verse 1: Kanye West & Jay-Z]
Hello, hello, hello, hello, white America, assassinate my character
Money matrimony, yeah, they tryna break the marriage up
Who gon' act phony, or who gon' try to embarrass ya?
I'ma need a day off, I think I'll call Ferris up
Bueller had a Muller but I switched it for a Mille
'Cause I’m richer, and prior to this shit, was movin' free base
Had a conference with the DJs (Yeah?), Puerto Rico three days
Poli with the PDs, now they got our shit on replay
Sorry I’m in pajamas but I just got off the PJ
And last party we had, they shut down Prive
Ain’t that where the Heat play? (Yeah)
Niggas hate ballers these days (Yeah)
Ain’t that like LeBron James?
Ain’t that just like D-Wade? Wait

[Sample: James Brown]
What you need, what–what you need
I got what you need, what–what you need (Bam)
What you need, what–what you need
I got what you need (Bam, bam, bam, bam, bam)

[Verse 2: Jay-Z & Kanye West]
Wussup, wussup, wussup, wussup
Wussup, muh'fucka? Where my money at?
You gon' make me come down to your house where yo' mommy at
Mummy wrap the kids, have ‘em cryin’ for they mommy back
Dummy that your daddy is, tell 'em I just want my racks
Racks on racks on racks (Racks!)
Maybachs on bachs on bachs on bachs on bachs
Who in that? Oh shit, it’s just blacks on blacks on blacks
Hunnid stack–How you get it? Nigga layin’ raps on tracks
I wish I could give you this feeling, I’m planking on a million
I’m riding through yo' hood, you can bank I ain’t got no ceiling
Made a left on Nostrand Ave., (Right), we in Bed Stuy
Made a right on 79th, I’m coming down South Shore Drive
I remain Chi-town, Brooklyn ‘til I die

[Outro: James Brown]
Take ‘em on home, take ‘em on home
Take ‘em on home, take ‘em on home
I got what you need, what–what you need
Take ‘em on home
What you need, what–what you need
I got what you need, what–what you need
Take ‘em on home, take ‘em on home
Take ‘em on home, take ‘em on home
Tryna hurt my name, huh?",JAY-Z & Kanye West,Gotta Have It,
"[Verse 1: Kanye West]
It was all good just a week ago, niggas feel theyselves
And that Watch the Throne drop, niggas kill themselves
What niggas gon' do, Hov?
This the new crack, on a new stove
I'm in the two-door, true that, niggas telling me, ""You back!""
Like a nigga ever left up out this bitch, huh?
And if life's a bitch, bet she suck my dick, huh
And I bet she fucked the whole clique, huh
By the way, nigga, you should fucking quit, nigga
Just forget it, you talk it, I live it
Like Eli, I did it, joke's on you, motherfucker, and I get it, haha
No paper, ho, but you can have some more of me
Or-a-gy or are we speaking metaphorically?
Historically I'm kicking bitches out like Pam, nigga
Going H·A·M, nigga, me and Jigga
And a nigga still young, why I have no kids
But I've been practicing with some actresses as bad as shit
Had a few white girls, asses flat as shit
But the head's so good, damn, a nigga glad he hit
Got 'em jumping out the building, watch out below
A million out the door

[Chorus: Kanye West]
I'm about to go H·A·M
Hard as a motherfucker, let these niggas know who I am
I'm about to go H·A·M
Hard as a motherfucker, let these niggas know who I am

[Verse 2: Jay-Z]
Fuck y'all mad at me for?
Y'all don't even know what I've been through
I played chicken with a Mack truck
Y'all muthafuckas woulda been moved
I swam waters with Great Whites
Y'all muthafuckas woulda been chewed
I hustled with vultures late nights
Y'all muthafuckas woulda been food
Fuck wrong with these dudes? Try to walk around in these shoes
See the shit I saw growing up
Then maybe you could take a peek at these boos
Niggas fantasize about the shit that I do daily
Like these rappers rap about all the shit that I do really
I'm like, ""Really: half a billi nigga, really?"" You got baby money
Keep it real with niggas, niggas ain't got my lady's money
Watch the throne, don't step on our robe
Bad enough we let you step on our globe
With my nephew die, daddy's dead
Nigga took the price on my uncle's head
Nobody called the cops as my uncle bled
So I feel like I would like to know my uncle's bread
Bow down, brother, pay homage
Don't spill hate all on my garments
Comme des Garçons, fuck yo' fresh
Head shots, nigga, fuck your vest
Fuck the pigs, no pork on my fork
Peace, God, 'cause you know a nigga just went

[Hook: Jay-Z]
H·A·M
Hard as a motherfucker, let these niggas know who I am
Yeah, I'm 'bout to go H·A·M
Hard as a motherfucker, let these niggas know who I am
Yeah, I'm 'bout to go H·A·M

[Outro]
Vivat rex in homine
Vivat rex in homine
Vivat rex in homine
Vivat rex in homine",JAY-Z & Kanye West,H·A·M,
"[Produced by Kanye West]

[Three minutes of silence]

[Intro: Kanye West]
1985 white Lamborghini Countach, two of 'em

[Chorus: Kanye West]
I need a slow motion video right now
'Cause I'm movin' in slow motion, slow motion
Feelin' like Hype Williams shootin' a nigga
Shootin' a nigga, hey, hey, hey
I need a slow motion video right now, ay, ay

[Verse 1: Kanye West]
Damn, baby, pussy can't be your only hustle
Unless you bad as Naomi Russell
I mean a lot of niggas got money
So basically, Russell ain't the only Russell
Russell Brand, Russell Crowe
Zero, zero, zero, zero, a whole lot of Os
What you after, actor money?
You in line behind currency, yeah, you after money
Bulletproof condom when I'm in these hoes
Got staples on my dick, why? Fuckin' centerfolds
And I swear to God they so cold
Got a nigga in Miami wearing winter clothes
I got my fur on, feelin' like Jerome
She got her fur too, we get our his and her on
Don't look at the jewelry, or get your blur on
Too close, you comatose, so dope, you overdose
Get back, you overclose, oh no
The hood was strugglin' but then I blessed them with that Polo
Niggas was making music and then my first solo
Collo Drolo, sponsored by Manolo
She got Zeppi Notos ready for some photos
Yeah and I'm cold, bitch, please try to keep the door closed
Lanvin thousand-dollar tee with no logos
Let me show you what I see when my eyes closed

[Bridge: Jay Z & Kanye West]
Take it how you want 'til a nigga dead
'Til then, I'm the illest motherfucker alive
Yeah, yeah, uh-huh
Whole world aiming at a nigga head
Because I'm the illest motherfucker alive
Yeah, yeah, uh-huh, hol' up

[Verse 2: Jay Z]
King Hov, I'm exactly what the fuck you think
Eleven in a row, Bill Russell rings
Michael Jordan swag, y'all think Michael Jordan bad
Nigga, I got five more rings than Michael Jordan had
Elvis has left the building, now I'm on the Beatles ass
Niggas hear Watch the Throne, yeah, it's like the Beatles back
Bey-Bey my Yoko Ono, Rih-Rih complete the family
Imagine how that's gon' look front row at the Grammys
Fuck your awards like Eddie Murphy's couch
The Roc is in the building, we should have stayed in the house
I don't even know what we doing here
Seems to me a complete waste of gear
Just a fuckin' waste of time, a complete waste of bottles
Niggas' fashion is weak, they be wastin' all the models
Got the oversized Rollie, let me show thee how to do it
When I say it then you see it, it ain't only in the music
Basquiats, Warhols, serving as my muses
My house like a museum so I see 'em when I'm peeing
Usually you have this much taste, you European
That's the end of that way of thinking, nigga, never again
Know when to leave when the heat is coming, I learnt that
This is where DeNiro would be if he ain't turn back
Fuck Sosa, this Hova, this is real life
This is what the ending of Scarface should feel like

[Chorus: Kanye West & Kid Cudi]
I need a slow motion video right now
'Cause I'm movin' in slow motion, slow motion
(I'm moving in slow motion, slow motion)
Feelin' like Hype Williams shootin' a nigga
(I'm moving in slow motion, slow motion)
Shootin' a nigga, hey, hey, hey
(I'm moving in slow motion, slow motion)
I need a slow motion video right now
(I'm moving in slow motion, slow motion)
Ay, ay
(I'm moving in slow motion, slow motion)",JAY-Z & Kanye West,Illest Motherfucker Alive,
"[Produced By: Don Jazzy, Jeff Bhasker, Kanye West, Mike Dean & Q-Tip]

[Spoken Intro: Jack King]
All engines running

[Chorus: Beyoncé]
We gon' take it to the moon, take it to the stars
How many people you know can take it this far?
I'm supercharged
We 'bout to take this whole thing to Mars (Lift off)
Now we gon' take it to the moon, take it to the stars
We don't know what we could do to make it this far
So many scars
We 'bout to take this whole thing to Mars

[Verse 1: Kanye West]
Lift off (lift off), lift off, takin' my coat off
Showing my tattoos, I'm such a show off, huh
I feel the pain and then roll off
I got the whole city, they about to go off
How many niggas with me up and in the aisle? (Lift off)
How many people want to roll on me now? (Lift off)
Like you know na na na, you know me by now (Lift off)
Know me (lift off), know me by now

[Chorus: Beyoncé]
We gon' take it to the moon, take it to the stars
How many people you know can take it this far?
I'm supercharged
We 'bout to take this whole thing to Mars (Lift off)
Now we gon' take it to the moon, take it to the stars
We don't know what we could do to make it this far
So many scars
We 'bout to take this whole thing to Mars

[Bridge: Kanye West]
Lift off (lift off), off, ah, like you know, na-na-na
You know me by now, know me, know me by now
You know me, know me by now, know me, know me by now

[Verse 2: Jay-Z]
Lift off
Rappers hear Watch the Throne, they gon' be pissed off
Earth is boring to 'em, shit is making my dick soft
When you earn hard as me, eventually you hit a big wall
5-4, 3-2, we need fuel, lift off

[Chorus: Beyoncé]
Now we gon' take it to the moon, take it to the stars
How many people you know can take it this far?
I'm supercharged
We 'bout to take this whole thing to Mars (All engines running)
Now we gon' take it to the moon, take it to the stars
We don't know what we could do to make it this far
So many scars
We 'bout to take this whole thing to Mars (Lift off)

[Spoken Word: Jack King]
(Lift off) 20 seconds and counting (Lift off)
(Lift off) T minus 15 seconds, guidance is internal (Lift off)
12, 11, 10, 9, ignition sequence start
6, 5, 4, 3, 2, 1, 0, all engines running
Lift off, we have a lift off (Lift off, lift off, lift off, lift off...)

[Outro: Beyoncé]
Jump
Now we gon', now we gon', now we gon', now we gon' (J-jump)
Now we gon' take it to the moon
Now we gon', now we gon' (J-j-jump)
We gon' take it to the moon
Take it to the stars (J-j-jump)
We gon' take it to the moon
Take it to the stars
How many people you know can take it this far?
Take it to the stars
How many people you know can take it this far?
Now we gon', now we gon', now we gon', now we gon', now",JAY-Z & Kanye West,Lift Off,Beyoncé
"[Produced By Mike Dean & Sak Pase]

[Intro: Frank Ocean]
And He'll bring you out the, out the darkness

[Chorus: Frank Ocean]
Sweet king Martin, sweet queen Coretta
Sweet brother Malcolm, sweet queen Betty
Sweet Mother Mary, sweet father Joseph
Sweet Jesus, we made it in America
Sweet baby Jesus (Ooh, ooh-ooh-ooh, ooh-ooh-ooh)
Oh, sweet baby Jesus, we made it in America
Sweet baby Jesus (Ooh, ooh-ooh-ooh-ooh)
Oh, sweet baby Jesus, we made it in America

[Verse 1: Kanye West]
I told my mama I was on the come up
She said, ""You going to school, I’ll give you a summer""
Then she met No I.D. and gave me his number
Ten years later, she driving a Hummer
Niggas hustle every day for a beat from Ye
What I do? Turn around, gave them beats to Jay
And I’m rapping on the beats they was supposed to buy
I guess I’m getting high off my own supply
Downtown, mixing fabrics, tryna find the magic
Started a little blog just to get some traffic
Old folks’ll tell you not to play in traffic, uh
A million hits and the web crashes, damn
South Park had 'em all laughing
Now all my niggas designing and we all swaggin', uh
Ignore the critics just to say we did it
This ain’t no fashion show, mothafucka, we live it

[Chorus: Frank Ocean]
Sweet king Martin, sweet queen Coretta
Sweet brother Malcolm, sweet queen Betty
Sweet Mother Mary, sweet father Joseph
Sweet Jesus, we made it in America
Sweet baby Jesus (Ooh, ooh-ooh-ooh, ooh-ooh-ooh)
Oh, sweet baby Jesus, we made it in America
Sweet baby Jesus (Ooh, ooh-ooh-ooh-ooh)
Oh, sweet baby Jesus, we made it in America

[Verse 2: Jay-Z]
I pledge allegiance to my Grandma
For that banana pudding, our piece of Americana
Our apple pie was supplied through Arm and Hammer
Straight out the kitchen, shh, don’t wake Nana
Built a republic that still stands
I’m tryna lead a nation to leave to my little man's
Or my daughter, so I’m boiling this water
The scales was lopsided, I’m just restoring order
Hold up, here comes grandma, what’s up Yaya?
What’s that smell? Oh, I’m just boiling some agua
No papa, bad Santa
The streets raised me, pardon my bad manners
I got my liberty chopping grams up
Street justice, I pray God understand us
I pledge allegiance to all the scramblers
This is the Star Spangled Banner

[Chorus: Frank Ocean]
Sweet king Martin, sweet queen Coretta
Sweet brother Malcolm, sweet queen Betty
Sweet Mother Mary, sweet father Joseph
Sweet Jesus, we made it in America
Sweet baby Jesus (Ooh, ooh-ooh-ooh, ooh-ooh-ooh)
Oh, sweet baby Jesus, we made it in America
Sweet baby Jesus (Ooh, ooh-ooh-ooh-ooh)
Oh, sweet baby Jesus, we made it in America
Yes, we did

[Outro: Frank Ocean]
Sweet baby Jesus (Ooh, ooh-ooh-ooh, ooh-ooh-ooh)
Oh, sweet baby Jesus, we made it in America
Sweet baby Jesus (Ooh, ooh-ooh-ooh-ooh)
Oh, sweet baby Jesus, we made it in America
Yes, we did",JAY-Z & Kanye West,Made in America,Frank Ocean
"[Produced by S1 and Swizz Beatz]

[I. ""Murder""]

[Intro: Jay Z]
Uh, bloody murder, murder, murder
Bloody murder, murder, murder, murder
Bloody murder, murder, murder, murder
Bloody murder, murder, murder

[Chorus: Kanye West]
Paper read: ""Murder, black-on-black murder""
Paper read: ""Murder, black-on-black murder"" again

[Verse 1: Jay Z]
Uh, this is to the memory of Danroy Henry
Too much enemy fire to catch a friendly
Strays from the same shade, nigga, we on the same team
Giving you respect, I expect the same thing, uh
All-black everything, nigga, you know my fresh code
I’m out here fighting for you, don’t increase my stress load
Niggas watching the throne, very happy to be you
Power to the people, when you see me, see you

[Verse 2: Kanye West]
And I’m from the murder capital where they murder for capital
Heard about at least three killings this afternoon
Looking at the news like, ""Damn! I was just with him after school""
No shop class, but half the school got a tool
And a ""I could die any day""-type attitude
Plus his little brother got shot reppin' his avenue
It’s time for us to stop and redefine black power
Forty-one souls murdered in fifty hours

[Chorus: Kanye West]
The paper read: ""Murder, black-on-black murder""
The paper read: ""Murder, black-on-black murder"" again
""Murder"" again

[Verse 3: Kanye West]
Is it genocide?
'Cause I can still hear his mama cries
Know the family traumatized
Shots left holes in his face about piranha-sized
The old pastor closed the cold casket
And said the church ain’t got enough room for all the tombs
It’s a war going on outside we ain’t safe from
I feel the pain in my city wherever I go
314 soldiers died in Iraq, 509 died in Chicago

[Verse 4: Jay Z]
I arrived on the day Fred Hampton died
Uh, real niggas just multiply
And they say by 21, I was supposed to die
So I’m out here celebrating my post-demise
If you put crabs in a barrel to ensure your survival
You're gon' end up pulling down niggas that look just like you
What up, Blood? Uh, what up, cuz? Uh, it’s all black, uh, I love us

[Chorus: Kanye West]
The paper read: ""Murder, black-on-black murder""
The paper read: ""Murder, black-on-black murder"" again
""Black-on-black murder"" again
""Black-on-black murder"" again

[II. ""Excellence""]

[Interlude: Jay Z]
It’s a celebration of black excellence, black tie, black Maybachs
Huh, yeah, uh

[Verse 5: Jay Z]
Black excellence, opulence, decadence
Tuxes next to the president, I’m present
I dress in Dries, and other boutique stores in Paris
In sheepskin coats, I silence the lambs
Do you know who I am, Clarice?
No cheap cologne whenever I “shh-shh”
Success never smelled so sweet
I stink of success, the new black elite
They say my Black Card bears the mark of the beast
I repeat: my religion is the beat
My verse is like church, my Jesus piece
Now please, domino, domino
Only spot a few blacks the higher I go, uh
What’s up to Will? Uh, shout out to O, uh
That ain’t enough, we gonna need a million more, uh
Kick in the door, uh, Biggie flow
I’m all dressed up with nowhere to go, uh

[Verse 6: Kanye West]
Yeah, it’s all messed up when it’s nowhere to go
So we won’t take the time out 'til we reach the T-O-P
From parolees that hold G’s, sold keys, low keys
We like the promised land of the OG’s
In the past if you picture events like a black tie
What the last thing you expect to see? Black guys
What’s the life expectancy for black guys?
The system’s working effectively, that’s why
I’ll be a real man, take care of your son
Every problem you had before this day is now done
New crib, watch a movie
'Cause ain’t nothin' on the news but the blues
Hit the mall, pick up some Gucci
Now ain’t nothing new but your shoes
Sunday morning, praise the Lord
You the girl that Jesus had been saving me for
So let’s savor this moment and take it to the floor
Black excellence, truly yours",JAY-Z & Kanye West,Murder to Excellence,
"[Produced By Kanye West, Ken Lewis, Mike Dean & RZA]

[Intro: Nina Simone & Kanye West]
Yeah, uh
Sun in the sky, you know how I feel
Me and the RZA connect
Breeze driftin' on by
Yeah, me and the RZA connect
Breeze driftin' on by (Uh)
It's a new life for me, yeah
It's a new dawn, it's a new day
It's a new life for me, ooh (Uh)
And I'm feeling good
Yeah, uh

[Verse 1: Kanye West]
And I’ll never let my son have an ego
He’ll be nice to everyone, wherever we go
I mean, I might even make him be Republican
So everybody know he love white people
And I’ll never let him leave his college girlfriend
And get caught up with the groupies in the whirlwind
And I’ll never let him ever hit the telethon
I mean, even if people dyin’ and the world ends
See, I just want him to have an easy life, not like Yeezy life
Just want him to be someone people like
Don’t want him to be hated all the time, judged
Don’t be like your daddy that'd never budge
And I’ll never let him ever hit a strip club
I learned the hard way, that ain’t the place to get love
And I’ll never let his mom move to LA
Knowin’ she couldn’t take the pressure now we all pray

[Break: Nina Simone & Jay Z]
Sun in the sky, you know how I feel
Breeze driftin' on by
Breeze driftin' on by
Me and the RZA connect
It's a new life for me, ooh
Me and the RZA connect
And I'm feeling good
Yeah

[Verse 2: Jay Z]
Sorry, junior, I already ruined ya
'Cause you ain’t even alive, paparazzi pursuin’ ya
Sins of a father make your life ten times harder
I just wanna take ya to a barber
Bondin’ on charters, all the shit that I never did
Teach you good values so you cherish it
Took me 26 years to find my path
My only job is cut the time in half
So at 13, we’ll have our first drink together
Black bar mitzvahs, mazel tov, mogul talk
Look a man dead in his eyes
So he know you talk truth when you speak it
Give your word, keep it
And if the day comes I only see him on the weekend
I just pray we was in love on the night that we conceived him
Promise to never leave him even if his mama tweakin’
'Cause my dad left me and I promise never repeat him
Never repeat him, never repeat him

[Outro: Nina Simone]
Sun in the sky, you know how I feel
Breeze driftin' on by
Breeze driftin' on by
It's a new life for me, yeah
It's a new dawn, it's a new day
It's a new life for me, ooh
And I'm feeling good
Sun in the sky, you know how I feel
Breeze driftin' on by
Breeze driftin' on by
It's a new life for me, yeah
It's a new dawn, it's a new day
It's a new life for me, ooh
And I'm feeling
Birds flyin' high, you know how I feel",JAY-Z & Kanye West,New Day,
"[Intro: Blades of Glory sample]
""We're going to skate to one song, one song only""
Ball so hard mothafuckers wanna fine me

[Verse 1: JAY-Z]
So I ball so hard mothafuckers wanna fine me
But first niggas gotta find me
What's fifty grand to a mothafucker like me?
Can you please remind me?
(Ball so hard) This shit crazy
Y'all don't know that don't shit faze me
The Nets could go 0 for 82
And I'd look at you like this shit gravy
(Ball so hard) This shit weird
We ain't even 'posed to be here
(Ball so hard) Since we here
It's only right that we'd be fair
Psycho: I'm liable to go Michael, take your pick
Jackson, Tyson, Jordan, Game 6
(Ball so hard) Got a broken clock
Rollies that don't tick-tock
Audemars that's losing time
Hidden behind all these big rocks
(B-ball so hard) I'm shocked too
I'm supposed to be locked up too
If you escaped what I've escaped
You'd be in Paris getting fucked up too
(B-ball so hard) Let's get faded
Le Meurice for like six days
Gold bottles, scold models
Spillin' Ace on my sick J's
(Ball so hard) Bitch, behave
Just might let you meet 'Ye
Chi-Town's D. Rose
I'm moving the Nets to BK

[Chorus: JAY-Z & Kanye West]
Ball so hard mothafuckers wanna fine me
That shit cray, that shit cray, that shit cray
B-ball so hard mothafuckers wanna fine me
That shit cray, that shit cray, that shit cray

[Verse 2: Kanye West & JAY-Z]
She said, ""'Ye, can we get married at the mall?""
I said, ""Look, you need to crawl 'fore you ball
Come and meet me in the bathroom stall
And show me why you deserve to have it all""
(Ball so hard) That shit cray, ain't it, Jay?
(B-ball so hard) What she order, fish fillet?
(B-ball so hard) ""Your whip so cold"" – this old thing?
(Ball so hard) Act like you'll ever be around mothafuckers like this again
Bougie girl, grab my hand
Fuck that bitch; she don't wanna dance
Excuse my French, but I'm in France, ahah, I'm just sayin'
Prince Williams ain't do it right if you ask me
'Cause I was him I would have married Kate and Ashley
What's Gucci, my nigga?
What's Louis, my killer?
What's drugs, my dealer?
What's that jacket, Margiela?
Doctors say I'm the illest
'Cause I'm suffering from realness
Got my niggas in Paris
And they going gorillas, huh

[Interlude: Blades of Glory sample]
""I don't even know what that means
No one knows what it means, but it's provocative
No, it's not, it's gross
Gets the people going""

[Chorus: JAY-Z]
Ball so hard mothafuckers wanna fine me
B-ball so hard mothafuckers wanna fine me

[Outro: Kanye West, JAY-Z & Both]
You are now watching the throne
Don't let me get in my zone
Don't let me get in my zone
Don't let me get in my zone
These other niggas is lyin'
Actin' like the summer ain't mine
(I got that hot bitch in my home)
(You know how many hot bitches I own?)
Don't let me get in my zone
Don't let me get in my zone
Don't let me get in my zone
Don't let me get in my zone
The stars is in the building
They hands is to the ceiling
I know I'm 'bout to kill it
How you know? I got that feeling
You are now watching the throne
Don't let me into my zone
Don't let me into my zone
(I'm definitely in my zone, zone, zone, zone, zone...)

[Produced by Anthony Kilhoffer, Hit-Boy, Kanye West & Mike Dean]",JAY-Z & Kanye West,Niggas in Paris,
