lyrics,artist,song_title,featuring
"[Produced By 88 Keys, Kanye West & Mike Dean]

[Chorus: Frank Ocean]
Human beings in a mob
What's a mob to a king? What's a king to a god?
What's a god to a non-believer who don't believe in anything?
Will he make it out alive? Alright, alright, no church in the wild

[Verse 1: Jay Z]
Tears on the mausoleum floor
Blood stains the Colosseum doors
Lies on the lips of a priest
Thanksgiving disguised as a feast
Rolling in the Rolls Royce Corniche
Only the doctors got this, I’m hiding from police
Cocaine seats
All white like I got the whole thing bleached
Drug dealer chic
I’m wondering if a thug’s prayers reach
Is Pious pious 'cause God loves pious?
Socrates asked, whose bias do y'all seek?
All for Plato, screech
I’m out here balling, I know y'all hear my sneaks
Jesus was a carpenter, Yeezy laid beats
Hova flow the Holy Ghost, get the hell up out your seats
Preach

[Chorus: Frank Ocean]
Human beings in a mob
What's a mob to a king? What's a king to a god?
What's a god to a non-believer who don't believe in anything?
Will he make it out alive? Alright, alright, no church in the wild

[Bridge: The-Dream]
I live by you, desire
I stand by you, walk through the fire
Your love is my scripture
Let me in through your encryption
Yeah, yeah

[Verse 2: Kanye West]
Coke on her black skin made it stripe like a zebra
I call that jungle fever
You will not control the threesome
Just roll the weed up until I get me some
We formed a new religion
No sins as long as there’s permission
And deception is the only felony
So never fuck nobody without telling me
Sunglasses and Advil
Last night was mad real
Sun coming up, 5 a.m
I wonder if they got cabs still
Thinking 'bout the girl in all leopard
Who was rubbing the wood like Kiki Shepard
Two tattoos: one read ""No Apologies""
The other said ""Love is Cursed by Monogamy""
It’s something that the pastor don’t preach
It’s something that a teacher can’t teach
When we die, the money we can’t keep
But we probably spend it all 'cause the pain ain’t cheap
Preach

[Chorus: Frank Ocean]
Human beings in a mob
What's a mob to a king? What's a king to a god?
What's a god to a non-believer who don't believe in anything?
Will he make it out alive? Alright, alright, no church in the wild

[Outro: Frank Ocean]
No church in the wild
No church in the wild
No church in the wild",JAY-Z & Kanye West,No Church in the Wild,"The-Dream, Frank Ocean"
"[Produced by Kanye West]

[Intro: Otis Redding & JAY-Z]
It makes it easier, easier to bear
You won't regret it, no, no, no
Some girls, they don't forget it
Love is their only happiness
Squeeze her, don't tease her, never leave her
Sounds so soulful, don’t you agree?

[Verse 1: JAY-Z]
Uh, I invented swag
Poppin' bottles, puttin' supermodels in the cab
Proof
I guess I got my swagger back, truth
New watch alert: Hublots
Or the big face Rollie, I got two of those
Arm out the window through the city, I maneuver slow
Cock back, snap back, see my cut through the holes

[Verse 2: Kanye West]
Damn, Yeezy and Hov, where the hell you been?
Niggas talking real reckless; stuntmen
I adopted these niggas, Phillip Drummond them
Now I’m 'bout to make them tuck their whole summer in
They say I’m crazy, but I’m 'bout to go dumb again
They ain't seen me 'cause I pulled up in my other Benz
Last week I was in my other other Benz
Throw your diamonds up 'cause we in this bitch another 'gain

[Verse 3: JAY-Z]
Photo shoot fresh, looking like wealth
I'm 'bout to call the paparazzi on myself
Uh, live from the Mercer
Run up on Yeezy the wrong way, I might murk ya
Flee in the G450, I might surface
Political refugee, asylum can be purchased
Uh, everything's for sale
I got five passports, I'm never going to jail

[Verse 4: Kanye West]
I made Jesus Walks, I'm never going to hell
Couture level flow is never going on sale
Luxury rap, the Hermès of verses
Sophisticated ignorance, write my curses in cursive
I get it custom, you a customer
You ain't accustomed to going through customs
You ain't been nowhere, hah?
And all the ladies in the house got 'em showing off
I'm done, I'll hit you up maña...nah!

[Verse 5: JAY-Z]
Welcome to Havana
Smoking Cubanos with Castro in cabanas
Viva México, cubano
Dominicano, all the plugs that I know
Driving Benzes with no benefits
Not bad, huh, for some immigrants?
Build your fences, we diggin' tunnels
Can’t you see we gettin' money up under you?

[Verse 6: Kanye West, Jay-Z & Both]
Can’t you see the private jets flying over you?
Maybach bumper sticker read: ""What would Hova do?""
Jay is chillin' (Uh), Ye is chillin' (Uh)
What more can I say? We killin' 'em
Hold up before we end this campaign
As you can see, we done bodied the damn lames
Lord, please let them accept the things they can't change
And pray that all of their pain be champagne

[Outro]
Scream it
Give it
Scream it",JAY-Z & Kanye West,Otis,Otis Redding
"[Produced by No I.D.]

[Intro: Jay Z]
We in the time of our lives, baby
Turn the music up, primetime

[Verse 1: Jay Z]
Uh, yeah, primetime, beat by Dion
Our third eon, that's what the fuck we on
Mo' money, 40-year-old phenom
My 15 minutes of fame has stretched beyond
At 42, be better than 24s
I carried the 4-5, mastered 48 laws
Still wearing my 23s, they can't fuck with the boy
As far as them 16s, I'm 23 of it all
Primetime, riding that six-deuce
That 911, I only subtract the roof
I started in '88, got warm in '92
I landed in '96, that's the year I came through
I hit the club, ordered some Grey Goose
Switched it for CÎROC to give Puff's stocks a boost
New money, I found the fountain of youth
I'm headed to Miami to fuck up the Fontainebleau
A case of Ace... make it two
Nigga, we rollin', beat the deuce
The night is young, what the fuck we gon' do? Ooh

[Chorus: Kanye West]
Ooh, the night is young, what the fuck you wanna do, huh?
The night is young, what the fuck we gon' do, huh?
The night is young, what you really wanna do, huh?

[Verse 2: Kanye West]
Primetime, basking in the lime
Cassius in his prime, coloring out of the line
'Cause they don't want nobody that's colored out of the lines
So I'm late as a motherfucker, colored people time
Damn, Yeezy, they all gotta be dimes?
Well, Adam gave up a rib, so mine better be prime
Niggas gon' kill me, I swear they better be lying
I never live in fear, I'm too out of my mind
Primetime, never hit these heights
I mean it's like, it's like our first first-class flight
I'm tripping on it, socks on marble floors, I'm slipping on it
Champagne, I'm sipping on it, shit tastes different, don't it?
You know what? You right
It's like the best damn champagne I had in my life
""When you coming home?"" That's a text from my wife
I told her run a bubble bath
And float in that motherfucker like a hovercraft
And soak in that motherfucker 'til I call you back
I mean, who says shit like that and doesn't laugh?
Hah...

[Chorus: Kanye West]
The night is young, what the fuck you wanna do, huh?
The night is young, what the fuck we gon' do, huh?
The night is young, what you really wanna do, huh?",JAY-Z & Kanye West,Primetime,
"[Produced By: Jeff Bhasker, Kanye West & Q-Tip]

[Intro: Kanye West]
Uh, hello, can I speak to, uh, uh
Yeah, you know who you are, look
You had no idea what ya dealing with
Something on some of this realest shit
Pop champagne, I'll give you a sip
'Bout to go dumb: how come?
Yeah, that's my bitch, that's my bitch
Sh-shorty right there? That's my bitch
That's my bitch

[Chorus: Elly Jackson & Kanye West]
I've been waiting for a long, long time
Just to get off and throw my hands up high
And live my life and live my life (Yeah)
Just to get off and throw my hands up high

[Verse 1: Kanye West]
I paid for them titties, get your own
It ain't safe in the city, watch the throne
She say I care more about them basquions
Basquiats, she learning a new word, it's 'yacht'
Blew the world up as soon as I hit the club with her
Too Short called, told me I fell in love with her
Seat by actors, ball players and drug dealers
And some lesbians that never loved niggas
Twisted love story, True Romance
Mary Magdalene from a pole dance
I'm a freak, huh, rock star life
The second girl with us, that's our wife
Hey, boys and girls, I got a new riddle
Who's the new old perv that's tryna play second fiddle?
No disrespect, I'm not tryna belittle
But my dick worth money, I put Monie in the middle
Where she at? In the middle

[Chorus: Elly Jackson]
I've been waiting for a long, long time
Just to get off and throw my hands up high
And live my life and live my life
Just to get off and throw my hands up high, high, high, high

[Bridge: Justin Vernon]
Swilling little licks and mixes ’til mornin'
I'm yearnin', ooh, yeah
Could I maybe have another dab of your potion?
Stop motion, ooh, yeah

[Verse 2: Jay-Z]
Go harder than a nigga for a nigga, go figure
Told me keep my own money if we ever did split up
How could somethin' so gangsta be so pretty in pictures?
Ripped jeans and a blazer and some Louboutin slippers
Uh, Picasso was alive he woulda made her
That's right, nigga, Mona Lisa can't fade her
I mean Marilyn Monroe, she is quite nice
But why all the pretty icons always all white?
Put some colored girls in the MoMA
Half these broads ain’t got nothing on Willona
Don’t make me bring Thelma in it
Bring Halle, bring Penélope and Salma in it, uh
Back to my Beyoncés
You deserve three stacks, word to André
Call Larry Gagosian, you belong in museums
You belong in vintage clothes crushing the whole building
You belong with niggas who used to be known for dope dealing
You too dope for any of those civilians
Now shoo, children, stop looking at her tits
Get ya own dog, ya heard? That's my bitch

[Chorus: Elly Jackson]
I've been waiting for a long, long time
Just to get off and throw my hands up high
And live my life and live my life
Just to get off and throw my hands up high, high, high, high",JAY-Z & Kanye West,That’s My Bitch,
"[Produced by Pete Rock]

[Chorus: Curtis Mayfield, Pete Rock & Charlie Wilson]
Add a little sugar (Ow!), honeysuckle and (Woo!)
A great big expression of happiness
Boy, you couldn't miss (Uh-huh; uh-huh) with a dozen roses
(Ay, uh; Mr. West) Such would astound you
(Pete Rock) The joy of children laughing around you
(Uh) These are all the makings of you (Woo!)

[Verse 1: Kanye West & Pete Rock]
I do it for the forefathers, yeah, the street authors
That are now A&Rs in the cheap office
Rappers that never got signed but they keep offers
Girls that's way too fine for us to keep off us
Gave her a handshake, only for my man’s sake
She in her birthday suit 'cause of the damn cake
Now there’s crumbs all over the damn place (Uh-huh)
And she want me to cum all over her damn face
I never understood Planned Parenthood
'Cause I never met nobody planned to be a parent in the hood
Taking refills of that Plan B pill
Another shorty that won’t make it to the family will
If I don’t make it, can’t take it, hope the family will
They ain't crazy, they don’t know how insanity feel
Don C. just had a shorty, so it’s not that bad
But I still hear the ghosts of the kids I never had

[Chorus: Curtis Mayfield, Pete Rock & Charlie Wilson]
Add a little sugar (Woo!), honeysuckle and (Come on)
A great big expression of happiness (Ow!)
Boy, you couldn't miss (Uh-huh; uh) with a dozen roses
(Kanye; ay, uh) Such would astound you
(Pete Rock) The joy of children laughing around you
(Uh) These are all the makings of you (Yeah)

[Verse 2: Kanye West]
No electro, no metro, a little retro, ahh, perfecto
You know the demo, your boy act wild
You ain't get the memo? Yeezy’s back in style
Now one room got Gidget, the other got Bridget
What’s more tripped out, dawg, is they sisters
Naw, you ain't listen, they black, they sistas
They mama named 'em after white bitches
So next time you see me on your fallopian
Though the jewelry’s Egyptian, know the hunger’s Ethiopian
Stupid questions like, ""Is he gon' be dope again?
Have you seen him? Has anybody spoke to him?""
This beat deserves Hennessy
A bad bitch, and a bag of weed: the Holy Trinity
In the mirror where I see my only enemy
Your life’s cursed? Well, mine’s an obscenity

[Chorus: Curtis Mayfield, Pete Rock, Charlie Wilson & Jay-Z]
Add a little sugar (Woo!), honeysuckle and (Come on; red lights)
A great big expression of happiness (Ow!)
Boy, you couldn't miss (Let that thing roll; uh-huh; uh) with a dozen roses
(Kanye; Ay, uh) Such would astound you
(Pete Rock; uh) The joy of children laughing around you
(Uh) These are all the makings of you (Yeah)
(Ow!)

[Verse 3: Jay-Z & Pete Rock]
This is my mama's shit
I used to hear this through the walls in the hood (Uh-huh)
When I was back in my pajama shit
Afros and marijuana sticks (Woo!), seeds in the ganja
Had it poppin' like the sample that I’m rhymin' with
Pete Rock (Uh), let the needle drop
I seen so much as a kid they surprised I don’t needle pop (Uh-huh)
Takin' sips of Pop's six-pack of Miller nips
Pink Champale, Ballantine Ale (Woo!)
Ballys on my feet help me balance out well
That and the shit I used to balance on the scale
I got it honest from the parties from my mama’s
Virgin Marys try to judge her
I’m like, ""Where are them Madonnas now?""
Give all glory to Gloria (One-two, okay)
They said, ""You raised that boy too fast""
But you was raising a warrior (One-two, okay)
We victorious, they’ll never take the joy from us, uh

[Outro: Kid Cudi & Pete Rock]
Keep your hands up, get 'em high now (It's Pete Rock, Kanye)
Don’t let them take your fire
Keep your hands up, get 'em high now (One-two, okay)
Don’t let them take your fire
Keep your hands up, get 'em high now (It's Pete Rock, Kanye)
Don’t let them take your fire
Keep your hands up, get 'em high now, yeah (One-two, okay)
It's Pete Rock, Kanye; one-two, okay
It's Pete Rock, Kanye; one-two, okay
It's Pete Rock, Kanye; one-two, okay
It's Pete Rock, Kanye; one-two, okay",JAY-Z & Kanye West,The Joy,Curtis Mayfield
"[Produced by Swizz Beatz]

[Ad-Libs: Swizz Beatz & Jay-Z]
Uh, right, oh, oh
Right (Yeah), one-two, one-two, ay

[Intro: Swizz Beatz, Kanye West & Jay-Z]
Welcome to the jungle, welcome to the jungle, well
(Yeah, yeah)
Welcome to the jungle, welcome to the jungle, well
(Yeah, uh, yeah)
I asked her where she wanna be when she 25 (Five)
She turned around and looked at me and said “alive”
Welcome to the jungle, welcome to the jungle, well
(Uh, oh)

[Verse 1: Jay-Z & Swizz Beatz]
Black Axl Rose, move halves and wholes (Right)
Come down to the jungle, just ask for Hov (Right)
Move blocks and squares, move apples and pears (Oh)
Work pots and pans (Goddammit), just to cop me some Airs
My uncle died, my daddy did too (Ay)
Paralyzed by the pain, I can barely move
My nephew gone, my heart is torn
Sometimes I look to the sky, ask why I was born
My faith in God, every day is hard
Every night is worse, that’s why I pray so hard

[Bridge: Kanye West & Jay-Z]
Why I pray so hard, this is crazy God
Just when I thought I had everything, I lost it all
So que será (Welcome to the jungle), get a case of Syrah
Let it chase the pain, 'fore it goes too far

[Verse 2: Jay-Z & Kanye West]
Yeah, my dreams is big, reality set in (Huh)
Let off a clip from a automatic weapon (Yeah)
Through shots in the door, it died in Vegas
Though it fought so hard, I knew it wouldn’t make it
I’m a tortured soul, I live in disguise
Rest in peace to the leader of the Jackson 5 (Ooh, woo)
I died in my sleep, I’m still Big Pimpin'
I ball at the mall, beginning of the ending (Yeah)
Where the fuck is the sun? It’s been a while
Momma, look at ya son, what happened to my smile?
My tears is tatted, my rag in my pocket
I’m just looking for love, I know somebody got it
Champagne for the pain, weed for the low
Goddamn, I’m so high, where the fuck did I go?
I’m losing myself, I’m stuck in the moment
I look in the mirror, my only opponent
Where the fuck is the press? Where the fuck is the Pres?
Either they know or don’t care, I’m fucking depressed
No crying in public, just lying to judges
Risking my life, I’m already dying, so fuck it, well

[Outro: Swizz Beatz]
Welcome to the jungle, welcome to the jungle, well
Goddammit",JAY-Z & Kanye West,Welcome to the Jungle,
"[Produced By Kanye West, Mike Dean & Sak Pase]

[Refrain: Flux Pavilion]
I can't stop-op-op-op
I can't stop

[Chorus: Kanye West & JAY-Z]
This is something like the Holocaust
Millions of our people lost
Bow our heads and pray to the Lord
'Til I die, I'ma fucking ball
Now who gon' stop me? Who gon' stop me, huh?
Who gon' stop me? Who gon' stop me, huh?
Black cards, black cars, black on black, black broads
Whole lotta money in a black bag
Black strap: you know what that's for

[Bridge: JAY-Z, Kanye West & both]
Who gon' stop me, huh?
Who gon' stop me, huh?
Yeah, who gon' stop me?
No brakes, I need State Farm
So many watches, I need eight arms
One neck but got eight charms
Who gon' stop me, huh?

[Verse 1: Kanye West]
Niggas talking, they bitch-made, ixnay off my dicksnay
That’s Pig Latin, itch-bay; who gon' stop me, huh?
Last night ain’t go so well, got kicked up out the hotel
Got a little freaky like Marvin Albert, ""Yes!"" Tell Howard Cosell
You just a commentator if you getting paper
Everybody I know from the hood got common haters
In some relations, you just supposed to say none
Heard she fucked the doorman
Well, that’s cool, I fucked the waitress
Heard Yeezy was racist, well, I guess that’s on one basis
I only like green faces

[Chorus: Kanye West & JAY-Z]
This is something like the Holocaust
Millions of our people lost
Bow our heads and pray to the Lord
'Til I die, I'ma fucking ball
Now who gon' stop me? Who gon' stop me, huh?
Who gon' stop me? Who gon' stop me, huh?
Black cards, black cars, black on black, black broads
Whole lotta money in a black bag
Black strap: you know what that's for

[Bridge: Kanye West & JAY-Z]
Y'all weed purple, my money purple
Y'all Steve Urkel, I’m Oprah's circle (Yeah, yeah, let's go)
I wrote the verse that I hope will hurt you

[Verse 2: JAY-Z & Kanye West]
Who gon' stop me, huh?
Beat the odds, beat the Feds
It wouldn’t be wise to bet against the kid
Start me broke, I bet I get rich
Night shift: six to six
Give me one shot, one pot
I’ll show up in all white, wearin' no socks
No ceiling, new coupe
They know I’m a dope boy, they don’t have no proof
I’m three steps removed, I know how to move
It's looking like I don’t know how to lose
I’m winning again, I’m at the Wynn
I’m at the table, I’m gamblin'
Lucky lefty, I expect a seven
I went through hell, I’m expectin' heaven
I’m owed, 'cause I'm dough, and I stuck to the G-code
I’m here, oh yeah, I promise I ain’t going nowhere
Okay, here, like a hare, like a rabbit, I like karats
I’m allergic to havin' bunny ears, like broke, like nope
Like ha, I ain’t no joke
I can’t be stopped, like nope, like nope
Extend the beat, Noah (...and pray to the Lord), uh

[Verse 3: JAY-Z]
Two seats in the 911, uh
No limit on the Black Card, uh
Told y'all I was gonna go H·A·M, uh
'Til the ocean was my backyard, uh
No lies in my verses, hey
Please pardon all the curses, hey
Shit gotta come in some way, fuck
When you're growing up worthless, uh
Middle finger to my old life, uh
Special shoutout to my old head, uh
If it wasn’t for your advice, uh
A nigga would have been so dead, uh
I'm living life til these niggas kill me
Turn this up if you niggas feel me
I’m riding dirty, tryna get filthy
Pablo Picasso, Rothkos, Rilkes
Graduated to the MoMA
And I did all of this without a diploma
Graduated from the corner
Y'all can play me for a muthafuckin' fool if you wanna
Street-smart and I’m book-smart
Coulda been a chemist 'cause I cook smart
Only thing that can stop me is me, hey
And I’ma stop when the hook start, hol' up

[Chorus: Kanye West & JAY-Z]
This is something like the Holocaust
Millions of our people lost
Bow our heads and pray to the Lord
'Til I die, I'ma fucking ball
Now who gon' stop me? Who gon' stop me, huh?
Who gon' stop me? Who gon' stop me, huh?
Black cards, black cars, black on black, black broads
Whole lotta money in a black bag
Black strap: you know what that's for",JAY-Z & Kanye West,Who Gon Stop Me,
"[Produced By Anthony Kilhoffer, Kanye West & Mike Dean]

[Chorus: Mr. Hudson]
Ooooh, I love you so
But why I love you, I'll never know
(Ooooh, I love you so
But why I love you, I'll never know)
Ooooh, I love you so
But why I love you, I'll never know
(Ooooh, I love you so
But why I love you, I'll never know)

[Verse 1: Jay-Z]
Picture, if you will, that the throne's burning
Rome's burning, and I’m sitting in the corner all alone, burning
Why does it always end up like this?
Something that we don’t determine
Same people that I fought for, that I fight for, that I ride for
That I live for, that I die for
Be the reason that these niggas is alive for
And they want me dead, but I’m sorry, but I just can’t die for you
But I can make 'em put their hands in the sky for you
We waiting for the fireworks like July 4th
Get fly more, get high more, cry boy, why for?
When the grief is over, beef is over
I’ll be fly when Easter’s over
I tried to teach niggas how to be kings
And all they ever wanted to be was soldiers
So when love is gone 'til blood is drawn
'Cause we no longer wear the same uniform
Fuck you, squares, the circle got smaller
The castle got bigger, the walls got taller
And truth be told, after all that said
Niggas still got love for you

[Chorus: Mr. Hudson]
Ooooh, I love you so
But why I love you, I'll never know
(Ooooh, I love you so
But why I love you, I'll never know)
Ooooh, I love you so
But why I love you, I'll never know
(Ooooh, I love you so
But why I love you, I'll never know)

[Verse 2: Jay-Z & Kanye West]
Showed love to you niggas
You ripped out my heart and you stepped on it
I picked up the pieces 'fore you swept on it
Goddamn, this shit leaves a mess, don’t it?
Shit feelin’ like death, don’t it?
Charge it to the game, whatever’s left on it
I spent about a minute, maybe less on it
Fly, pelican, fly, turn the jets on it
But first I shall digress on it
Wasn’t I a good king?
Maybe too much of a good thing, huh?
Didn’t I spoil you? Me or the money, what you loyal to?
Huh, I gave you my loyalty
Made you royalty and royalties
Took care of these niggas' lawyer fees
And this is how niggas rewarded me, damn

[Chorus: Mr. Hudson]
Ooooh, I love you so
But why I love you, I'll never know
(Ooooh, I love you so
But why I love you, I'll never know)

[Verse 3: Jay-Z & Kanye West]
Bussin’ at me, b-b-b-bussin’ at me
But I’m bulletproof, bitch, you can’t get nothin’ past me
Got body armor
A nigga gotta watch the throne
And I’m bussin’ back
So niggas in a glass house should not throw stones
What do you do when the love turns to hate?
Gotta separate from these fuckin' fakes
Caesar didn’t see it so he ceased to exist
So the nigga that killed him had keys to his shit
Am I my brother’s keeper?
Only if that nigga don’t creep up
Got a pistol under my pillow
I’ve never been a deep sleeper
P-p-p-paranoia, 'cause the nigga that said he’ll
Blast for ya is now blastin' for ya
That’s an assassin for ya
These niggas got a shot, they’ll shoot
Please Lord, forgive him
For these niggas not know what they do, ooh",JAY-Z & Kanye West,Why I Love You,Mr. Hudson
