lyrics,artist,song_title,featuring
"Well, it's almost nightfall
And there's no forecast of rainfall
And I'm in the mood for a party
So I'm gonna go out to a club
And give the dancefloor body
So I jump in the car and go to the venue
Walk in the door and now I'm on the menu
Guys in the house, they're wacthing me
They're clocking me, there's no stopping me

[Refrain:]
(desire) I know you want me
(you're fine) thank you
But I'm not the type of girl that you think I am
I don't jump into the arms of every man
(but I'm paid) I don't need your money
(I love you) you must be mad
Easy lover is something that I ain't
Besides, I don't know you from a can of paint

Tell me why is it when I walk past the guys
I always hear, yo, baby?
I mean like what's the big idea?
I'm a queen, nuff respect
Treat me like a lady
And, no, my name ain't yo and I ain't got your baby
I'm looking for a guy who's sincere
One with class and savoir faire
I'm looking for someone who has to be
Perfect for the queen latifah me

(fly girl, fly girl)
(come here, cuz you're sexy and you're fine)
(and I want you to be mine)
(fly girl, fly girl)
(have no fear, your heart is in good hands)
(won't you let me be your man? )

All my friends are in relationships
Some of then good ones and some of them bad ones
Some of the bad ones took a turn for the better
And some of the good ones ended up sad ones
You see? loving, it ain't hard to get
I want a friend not just a lover
Someone who is dedicated only to me
Not to me and two or three others
One who will not lie to me or think
He can get my love by buying me
I know I'll find him some day
And when I find him
He sure won't say

[Refrain]

(fly girl, fly girl
(come here, cuz you're sexy and you're fine)
(and I want you to be mine)
(fly girl, fly girl, have no fear)
(have no fear, your heart is in good hands)
(won't you let me be your man? )

Lounging, sitting in the house
And I'm cooling, first day of the week
So there's nothing to do
And I'm in the mood for a real soft kiss
Momma never said there'll be days like this
So I called her and we talked for a while
Hang up the phone feeling better
With a smile

It's cool, cuz 91 is my year
And this time I know I'm gonna hear

(fly girl, fly girl, come here)
(come here, cuz you're sexy and you're fine)
(and I want you to be mine)
(fly girl, fly girl)
(have no fear, your heart is in good hands)
(won't you let me be your man? )

[Refrain]

Fly girl [15x]",Queen Latifah,Fly Girl,
"Go head
Go head
Go head
Go Latifah

Go head
Go head
Go head
Go Latifah

Go head wit that bullshit
Pop a can of fake shit
Never should've pulled it
Now you wanna stay quick
Shake it, break it
Never catch me naked
If them checks is basic
Slide with them paces
Big jeans, big keans
I only ride them big things
Pay me for my sixteens
Switch in my fitted jeans
Twistin' up that icky green
Book full of city dreams
Now everybody half way there swing
Let's swing baby
Let's swing baby
Let's swing baby

Go head wit that nonsense
Address me as your highness
I'm New Jersey's finest
Back from Bahamas
Aware of my content
Sista got sponsors
Dana got a conscience
Let me hit responses

Go head
Go head
Go head
Go Latifah

Go head
Go head
Go head
Go Latifah

I see poppin' on me
Don't get sloppy on me
He be lookin' at me
She be hatin' on me
Well um basically
We just keepin' the peace
We just rulin' the night
With the family

Now you want some new shit
I keep it movin' who wit
My flavor unit
Bumpin' on exclusive

Jumpin' down in Houston
Peace to Whitney Houston
Tyin' up some nuisance
Ridin' wit a few friends
The science of the crew is
Neva give 'em units
We win the humor
Late let her move it
Everybody ruthless
Watch me make deuces
Thinkin' he the new shit
Time to gin and juice this
Story unconclusive
Now introducin'
Jumpin' jumpin' movin'
Somethin' bumpin' who wit
LA's Jersey unit
Lot of cats included
Single droppin' June-ish
LA.....

Go head
Go head
Go head
Go Latifah

Go head
Go head
Go head
Go Latifah

Let's swing baby
Let's swing baby
Let's swing baby
Let's swing baby

Lady bubble bubble for my thug
Startin' that trouble
Little homies born in the struggle
I show you I love you
Get in a huddle
Peace to mommies workin' a double
Dana'll hug you
Piss me off I'll get em to mug you
I'm the same princess of the posse
Sippin confossey
If you can't sang
You can't copy what's gone stop me
In a black beat swizzey
And I'm pumpin' my posse
And plus I'm stocky
I dare on of y'all broads to try and stop me
La stays layin' the fire
Displayin' the wire
And I'm paid now
So twenty years just stainin' the tires
President buyer
Peasants can't grow with the sire
And whoever told you LA wouldn't drop is a liar

Go head
Go head......",Queen Latifah,Go Head,
"1, 2, 3, Huh!

Boom laka laka laka boom laka laka boom de boom
Hey! Hey! Hey! Hey! Hey!

Feelings getting stronger
Caleb: Music's gettin longer too!
Olivia: Music is the flesh in me!
He wants to, he wants to, he wants to take you

Higher
Yeah yeah, He'll, He'll take you
Higher
Ooh, if you let Him
He will light your fire
Your fire, yeah, He'll take you
Higher!
He'll take you higher

Boom laka laka laka boom laka laka boom de boom!
Hey! Hey! Hey! Hey! Hey!

Yeah yeah yeah! Yeah! Yeah!

Up in the church with my homies
Tryin' to get a little praise on
But keep it down on the low key (low key)
Cause you know how it is
I saw shawty, she was checkin' up on me
From the game she was singin' in my ear
You would think that she knew me (knew me)
So we decided to chill!

The worship got heavy (heavy)
Had me feeling like I'm ready to blow (blow)
Oh (oh)
God's saying ""Come get me!"" (Come get me)
So I got down and brought my knees to the floor
My knees to the floor
That's when I told God I said

Yeah yeah!
So I got down low said ""God come get me!""
Yeah yeah
I got so caught up because God told me
Yeah yeah
Now my God and I are the best of homies
Yeah yeah
Next thing I knew I was all up on it screaming

Yeah yeah
Yes, I love you
Yeah yeah
Yes, I do
Cast: Yeah yeah
Won't you let me
Yeah Yeah
Take you

Higher
Higher, He'll take you
Higher
Higher, if you let Him
He will light your fire
He will start your fire
Higher
Higher
Higher
Higher

It's like I've waited my whole life, for this one night
It's gonna be me, you, and the good Lord
Cause we've only got one night, sing for His pleasure
Sing for His Son and praise

Forever (Ever ever)
Forever (Ever ever)
Forever (Ever ever)
Forever with the good Lord!

Forever (Ever ever)
Forever (Ever ever)
Forever (Ever ever)
Forever with the good Lord!

I'm a beautiful lady
No ifs, ands, or maybes
I'm releasing my heart
And I'm feeling amazing!
There's no one else that matters, no no no
He loves you (He loves me)
And He won't (And He won't)
Let you fall!

He will take you

Higher
Oh yeah, He wants to take you
Higher
Higher, He will
He will light your fire
Light your fire, don't you wanna go
Higher
Higher
Higher
Higher

Uh huh, yeah

Like a fool I went astray, oh Lord
Now I'm wonderin, if Your love's still strong (Ooh Lord)
Oh Lord, here I am
Signed, sealed, delivered, I'm Yours

Then that time I went and said goodbye!
Now I'm back and not ashamed to cry! (Ooh Lord)
Oh Lord, here I am
Signed, sealed, delivered, I'm Yours
I'm Yours

Here I am Lord
Oh I'm here right now
Signed, sealed, delivered, I'm Yours
You got the future in your hands
Yeah
Yeah yeah yeah
Here I am Lord
Here I am Lord
Signed, sealed, delivered, I'm Yours

He wants to take you higher
Signed, sealed, delivered!
I'm feelin
Higher!
Take me!
I'm Yours

Higher!
He'll take you
Signed, sealed, delivered
Higher, high now
Higher
I'm Yours

Higher
Higher
Signed, sealed, delivered
Higher yeah
Higher
Oh yeah
Higher
Yeah

Higher
Signed, sealed, delivered, come on
Signed, sealed, delivered
I'm yours
Oh yeah
Higher
Higher
Higher
Higher

Higher
Higher
Signed, sealed, delivered
Signed, sealed, delivered
Yeah
Higher
Oh yeah
Higher
Higher
Boom laka laka laka boom boom boom

Higher
Higher
Higher",Queen Latifah,Higher Medley,"Dequina Moore, Angela Grovey, Dolly Parton, Don Henson, Andy Karl, Keke Palmer"
"[Chorus]
How do I love thee
Let me count the ways
How much do I love you
Well, multiply your love by infinity

Picture a vision of beauty
As we dance by the light of the moon
Your passion so often consumes me
Like the lick of a native tongue tune
Reality is ours to create
Fantasy is ours to mold
Dream my love dream
With my body and my soul
Question out my faith
I'm pledged to be your lover
And after I started loving you
I knew I'd never love another
I'm like a child within your arms
Would you come inside and play with me
Spend the day with me
Have your way with me

[Chorus]

Remember this always
My sweet one
No lie is true
And dude it's not a lie
When I say that
I would die for you
You're so deep within thee
That sometimes your just a touch away
But I can't reach you
I seek you
Come to me
But then you""re all around me
You just surround me
And you astound me
And I recieve you
'fore I complete you
It pleases me
To have you touch me there
I think you know it gets to me
Stop
Don't stop
Ecstacy

[Chorus]

So sweet
I adore you
Come to me
That's right
Come to me

How do I love thee
Let me count the ways
How do I love thee
Let me count the ways

Reality is ours to create
Fantasy is ours to mold
Dream my love dream
With my body and my soul
Question out my faith
I'm pledged to be your lover
And after I started loving you
I knew I'd never love another
I'm like a child within your arms
Would you come inside and play with me
Spend the day with me
Have your way with me

Please don't go
Happiness is nothing without you
Stay
My sweet one
I adore you
Hold me
Come to me
Love me
Love me",Queen Latifah,How Do I Love Thee,
"Betcha got a chick on the side, sure you got a chick
I know you got a chick on the side
I know you got a chick on the side
I know you got a chick on the side
I know you got a chick on the side

I know you want us both and I know the reason why
I can give you so much lovin
But presents, she can buy you
Last night youre in my arms
Tonight Im all alone

[Chorus:]
How long will this game go on? How long?
Oh, oh how long?

Betcha got a chick on the side, sure you got a chick
I know you got a chick on the side

And its plain, plain enough to see that
Youre not the man for me
I can't keep playin games that keep my heart in pain
I want to turn and walk away but its harder to do
Than it is to say

[Chorus]
It might hurt me for awhile but of one thing I am sure
Ill get over you, yes Ill find someone new
Each time I open up my heart
It seems to just get torn apart

[Adlib line 1:]
I saw you, dont you try to hide
Dont hide it from me, no, no. no

[Adlib line 2:]
You thought you would hide it, hide it
Hide it from me
[Repeat...]

Yeah, check you out
I bet you thought I didn't know a daggone thing
I bet you thought you had me fooled, didn't you?
I know you got a chick on the side
My sisters saw you with her
So did my cousin
She sent a picture to my cellphone
I saw the video on YouTube
My other sister saw you too!
My niece even saw you with her!",Queen Latifah,How Long (Betcha’ Got a Chick on the Side),
"[Chorus:]
I can't understand, I can't understand
I can't understand, I can't understand
(It's got me goin' crazy, things are goin' crazy)

[Verse 1: Queen Latifah]
Forgive me father for I have sinned
I just destroyed another phony ass rapper again
She wasn't causin' it
She must be stupid as a fiend
I should have told the child 'You don't step to the Queen!'
Perplexed and I'm vexed cause' everywhere I go
People be flexin' expectin' me to wanna flow
I don't play that, the only way that
I would be playing is if I pay back
And run the playback so whatcha sayin'?
You don't wanna be a sista' in the name of rap
And yet you wanna talk shit and your style is wack
I would have squashed it before and made the whole issue dead
But now I'm fed, so it's off with your head
Now
The moral of the verse is your career is through
And don't be fuckin' with nobody who ain't fuckin' with you
If I was in yo shoes I'd let the BS start walkin'
Next time there might not be no talkin'

[Chorus]

[Verse 2: Queen Latifah]
A brotha pushed up on me at the movies one weekend
He was on a quest and I was who he was seekin'
And although I am Black and he was a Puerto Rican
Ain't make no diff to me, so we continued to speak and
We hit it right off and everything was on a roll
Before I knew it, I fell in love with his soul
""Aye papi! Aye!"" Was the cry as he made love to me
I was freaked by the way he used to do me
And then one day when I was washin' our clothes
A number fell outta his pocket and her name was Rose
A girl's number? Hmmm. That struck me kinda funny
I lost my grip, I had to call up the honey
""There was a chick on the side!"" Oh no it couldn't be!
""There was a chick on the side!"" He's down with OPP?
I gave you the whole shabang
Just to find another woman hittin' my thang

[Chorus]

[Verse 3: Queen Latifah]
Why the negative vibes? And why do people take bribes?
I don't understand it, yo (I don't know)
Why do bad people live? And why do good people die?
Somebody gotta tell me why  (I don't know)
Why do people smoke crack? And why do White fight Black?
What's that scenario?  (I don't know)
Why do hearts get broken? Why the chumps get choked?
They know I ain't no joke  (I don't know)
Now, with the drums to the bass to the piano to the horn
It's a crazy ass life and that's my word, it's bond
I'm tryin' to be as logical as I possibly can
But for the life of me, you know I just can't understand
What's goin' on sometimes
So situations like this come out in my rhymes
But Queen Latifah ain't gone just yet
Cause' when it comes to masterin' confusion I'm a VET

[Chorus]",Queen Latifah,I Can’t Understand,
"Oh I don't know
And it makes me scared
Because I'm falling in love
And I don't know if you feel the same

I'm taking this time to write you this letter
Cause what we got is good but want to make it better
Yo boo, I'm digging you, you got all of the equipment
Now I'm ready for a commitment

I'm not trying to rush things
Not looking for an engagement ring
But the queen needs a king
And I choose you, cause what we got is in tune
Since you promised me the moon I hope to see it soon
(see it soon)

I want make this official man, I miss you
I feign for your touch and your kiss too
Listen I hope I'm not being to blunt
Don't wanna scare you away, it's a game I want to play but

Oh I don't know
And it makes me scared
Because I'm falling in love
And I don't know if you feel the same

(hey)
Oh I don't know
(I don't know)
And it makes me scared
(so scared)
Because I'm falling in love
(falling in love)
And I don't know if you feel the same
(falling in love, hey)

I know you love it when I call you big poppa
My thoughts are pure
I heard you left your last cause she was insecure
I'm not tryin' to compare myself but
I got health and wealth
And now you dealing w/ the top shelf
My orgasmic thoughts need support
Thinking of positions you taught
While I stare at the gifts you bought

The things you do for me make you my number one
When you're around I have a lot of fun
Check me now
Like the time we went to six flags
Boostin', tearin' off tags
And sticking souvenirs into our bags
Slipped up, almost got caught then tried again
You're more than a lover you my best friend

Do you remember the first time I let cha get it
I was nervous you were too but wouldn't admit it
You were the best I had that's why I want all of you
Now tell them hookers to stop calling you
I'm dead up I want to wear your name
So I pray and ask god to make you feel the same

(hey)
Oh I don't know
(don't know)
And it makes me scared
(It makes me so scared)
Because I'm falling in love
(I'm falling in love again again)
And I don't know if you feel the same
(baby baby baby baby)

(hey)
Oh I don't know
(I don't know)
And it makes me scared
(makes me scared)
Because I'm falling in love
(falling in love again)
And I don't know if you feel the same
(baby baby, oh oh oh yeah)

Is there a place to ease my mind
(place to ease my mind)
(think about you all the time, yeah)
Show me a sign and wish that you would offer me a sign
Relax my mind

Let me close by saying stop delaying our fate
Let go your fear I'm here come hold your soul make
I want more but I don't want push
It's never to late so be straight
Don't beat around the bush

I'm all woman if you don't feel like I feel that's fine
Let's stay friends but I want you to be mine now check it
But I'll take what I can take it can't get no plainer
With love sincerely yours your boo dana

Oh p.s. guess who's back around
My ex he called me said he bought a house up town
But I told him that my love for you was too strong
Write back and don't make me wait to long

Oh I don't know
Oh I don't know
(I don't know)
And it makes me scared
(makes me so scared)
Because I'm falling in love
(falling in love)
And I don't know if you feel the same
(I want to know, wanna know)

(Just me and my queen
Do you know what I mean
Hey hey hey
Falling in love
Tell me if it's good enough for you)",Queen Latifah,I Don’t Know,SisQó
"[MISS MAYBELLE]
There's a light in the darkness
Though the night is black as my skin
There's a light burning bright, showing me the way
But I know where I've been

[MISS MAYBELLE]
There's a cry in the distance
It's a voice that comes from deep within
There's a cry asking why, I pray the answer's up ahead, yeah
'Cause I know where I've been

[MISS MAYBELLE]
There's a road we've been travelin'
Lost so many on the way
But the riches will be plenty
Worth the price, the price we had to pay

[MISS MAYBELLE]
There's a dream in the future
There's a struggle that we have yet to win
And there's pride in my heart 'cause I know where I'm going
Yes I do!
And I know where I've been, yeah

[MISS MAYBELLE & ENSEMBLE]
There's a road (There's a road)
We must travel (We must travel)
There's a promise (There is a promise)
We must make (That we must make)
But the riches (Oh, but the riches)
Will be plenty (The riches will be plenty)
Worth the risk (Worth the risk)
And chances that we take (and the chances that we take)
There's a dream
Yeah yeah yeah
In the future
There's a struggle
That we have yet to win
Use that pride
In our hearts
To lift us up
Until tomorrow
Cause just to sit still
Would be a sin

[ENSEMBLE]
I know it, I know it
I know where i'm going

[MISS MAYBELLE]
Lord knows I know
Where i've been

[Miss Maybelle & ENSEMBLE]
Oh! When we win
I'll give thanks to my god 'cause I know where I've been",Queen Latifah,I Know Where I’ve Been,Nikki Blonsky
"What you mean, wanna know how I feel about you, baby?
Be poetic about it, alright

I love the east, I love the west
And north and south, they're both the best
But I'll only go there as a guest
'Cause I love being here with you

I love the sea, I love the shore
I love the rocks but what is more?
With you they'd never be a bore
'Cause I love being here with you

Singin' in the shower, laughin' by the hour
Life is such a breezy game
Love all kinds of weather, as long we're together
I love to hear you say my name

I like good wine and fine cuisine
And candle light, I like the scene
But baby, if you know what I mean
'Cause I love being here with you
I love being here with you

I like a dance by Fred Astaire
And Brando's eyes, Yul Brynner's hair
But I think to tell you's only fair
That I love being here with you

And Cary Grant, oh do-dah-day
His utter charm takes me away
But don't get me wrong, how do you say
I love being here with you

Oh, Basie's band's a-swingin', I like Ella singin'
'Cause there's something else, you know
They know how to say it, they know how to play it
They wind it up and let it go

I love the thrill of New York shows
I'd love to Durante's nose
But I'd like to say before I close, yeah, yeah
I just love, baby I love, well, I love being here with you",Queen Latifah,I Love Being Here with You,
"I'm not in love
So don't forget it
Its just a silly phase im going through
And just because
I call you up
Don't get me wrong
Don't think you got it made
I'm not in love
No no no
Its because

I like to see you
But then again
That doesn't mean
You mean that much to me
So if i call you
Don't make a fuss
Don't go and tell your friends
About the two of us
I'm not in love
Oh no no
It's because

Oh oh oh
You wait a long time for me
Oooo ooo you wait a long time yeah

I keep your picture
Right there on the wall
It hides a nasty stain thats been lying there

So don't you ask me to give it back
I know you know it don't mean on thing to me

I ain't in love
No no no no
It's because

Oh oh oh
You wait a long time for me
Oooo ooo you wait a long time yeah

I'm not in love
No i'm not in love
No no no
I ain't in love
No no no no
It's because

Oooooh
You wait a long time for me
Darlin ooo
You wait a long time for me

I ain't in love, i ain't in love no no no
I ain't in love, i ain't in love, i ain't in love
I ain't thinkin bout you baby
I dont miss you like crazy
I ain't in love i ain't in love i ain't in love
Keep waiting, keep waiting",Queen Latifah,I’m Not In Love,
"[Intro]
Uh huh, well the name is Latifah, you hear me coming through
The speaker. Hit it Mark, 45 King

[Verse 1]
I am a bill, yes I'm only a bill when
It's time to ill I get ill and time to chill
I chill, my homeboy said this was the D.A.I.S.Y. age
I take it as meaning you have to get crazy paid
You hope I'm from your borough, because I'm thorough
You want me to be down with you, to be seen walking around with you
Go to the store and buy a brew and rock a rhyme or two
So you can bite it, you taste it, you like it
You think I'm sleeping on you? Please, don't even try it
The name is Latifah, the scene, it is mine
The 45 King keeps the beat and the time while I
Rock to the rhythm and keep it blowing out
So don't try to turn me inside out

[Chorus]
Latifah is the name you love
Flying through rhymes like a dove
Slapping suckers with a glove
Challenge me and you will burn
Yes in the fire you will burn

[Verse 2]
It's so so simply done
When I find that I have to run
Lyrics to music by the King of Swing, The 45 King
The words we bring I write, and sing
Cause I am Latifah, the Queen of course
Don't try to get yours off, because the cause is lost
Mark conducts the beat, I watch it hit them
Won't you chill? I don't need another victim
To add to the list of aggravation
Subtracting suckers like a math computation
We are not teaching pupils and subjects with no scruples
This is a King and Queen creation
So hello hello hello and how ya doing?
Forget the small talk now, it's time for me to ruin
Those who don't believe in what I'm saying
When I put up the wall of words ain't no way into my Queendom
Controlled by me, the heir to the throne is the Ruler Lord Ramsey
The Ruler Lord, to him there is no equal
He grabs it and starts bombing people
Don't listen to me to figure me out
Because you can't turn my mind inside out

[Chorus]
Latifah is the name you love
Flying through rhymes like a dove
Slapping suckers with a glove
Challenge me and you will burn
Yes in the fire you will burn

[Verse 3]
Rhyming's not a question of one superiority
But rather how you delegate the use of your authority
I know who you are, and I know who you are to me
But I came here just to party
If it's a show you want, the show it live
And if it's trouble you seek, I have arrived
When Mark requests my approval, I nod
And after each and every single rhyme I thank God
Altough a taste of my body would soothe you
I give you just my voice and watch the rhythm move you
The method of my lyrics makes the funky people feel it
And Lord have mercy on those that try to steal it
Latifah is a name meaning ""delicate and sensitive""
But I have no problem formulating sentences
To break you down to the ground
I won't use violence, the color of this is brown
And I am down, but never ever down and out
So don't try to turn me inside out

[Chorus]
Latifah is the name you love
Flying through rhymes like a dove
Slapping suckers with a glove
Challenge me and you will burn
Yes in the fire you will burn

[Outro]
Jah know? Cause ah...
Music, 45 King, music Latifah the Queen
Music, domination to bring the world
Irie, say in the fire you will burn (Repeats to fade)",Queen Latifah,Inside Out,
